{
  "timestamp": "2025-11-14T18:40:31.265Z",
  "pages": [
    {
      "name": "People Directory",
      "url": "https://www.eemb.ucsb.edu/people",
      "status": 200,
      "screenshot": "/Users/adrianstiermbp2023/eemb-website-redesign-2025-2026/docs/people-scrape-results/screenshots/people-directory.png",
      "data": {
        "fullText": "Skip to main content\nMain navigation\nAbout\nPeople\nResearch\nAcademics \nNews\nEvents\nSupport \nGive\nPeople\nPrimary tabs\nFull Directory\n(active tab)\nFaculty\nAdjunct\nEmeriti\nStaff\nResearch Scientists\nStudents\nLeadership\nName\n \nFilter by\n- Any -\nFaculty\nResearcher\nStaff\nStudent\n Apply\nAlice Alldredge\nProfessor Emeritus\nalice.alldredge@lifesci.ucsb.edu\n209 Building 408\nFaculty\nEvelin Ambrocio-Silva\nUndergraduate Academic Advisor\neambrocio@lifesci.ucsb.edu\n805-893-4622\nLSB 3320\nStaff\nLeander Anderegg\nAssistant Professor\nlanderegg@ucsb.edu\n\nFaculty\nIvanna Arrizon Elizarraras\nGraduate Student\niarrizonelizarraras@ucsb.edu\nMSRB 2409\nStudent\nDaniel Botkin\nProfessor Emeritus\ndanielbotkin@rcn.com\n917.747.3068\n\nFaculty\nCherie Briggs\nProfessor\nbriggs@lifesci.ucsb.edu\n805.893.2199\n2112 Noble Hall\nFaculty\nMark Brzezinski\nResearch Professor\nbrzezins@lifesci.ucsb.edu\n805.893.7061\n3149 Marine Biotech\nFaculty\nAn Bui\nGraduate Student\nan_bui@ucsb.edu\n2125 Noble Hall\nStudent\nDeron Burkepile\nProfessor\nderon.burkepile@lifesci.ucsb.edu\n805.893.3067\n4312 Marine Science Institute\nFaculty\nCraig Carlson\nProfessor Emeritus\ncarlson@lifesci.ucsb.edu\n805.893.2541\n3147 Marine Biotech\nFaculty\nJenn Caselle\nAdjunct Faculty\nResearch Biologist\njenn.caselle@ucsb.edu\n805.893.5144\n4314 Marine Science Institute\nFaculty\nNoe Castaneda\nGraduate Student\nnoe.castaneda@lifesci.ucsb.edu\n\nStudent\nBraulio Castillo\nGraduate Student\nbraulio.castillo@lifesci.ucsb.edu\n\nStudent\nJoe Celebrezze\nGraduate Student\ncelebrezze@ucsb.edu\n805.893.xxxxx\nNoble Hall 1111\nStudent\nJames Childress\nResearch Professor\nchildress@lifesci.ucsb.edu\n\nFaculty\nIvia Closset\nResearch Associate\nivia@ucsb.edu\n\nResearcher\nPeter Collins\nProfessor Emeritus\ncollins@lifesci.ucsb.edu\n805.893.4425\n214 Building 408\nFaculty\nScott D. Cooper\nResearch Professor\nsdcooper@ucsb.edu\n805.893.4508\n2136 Noble Hall\nFaculty\nCarla D'Antonio\nProfessor\ndantonio@es.ucsb.edu\n805.893.2796\n4002 Bren Hall\nFaculty\nLaura Dagg\nGraduate Student\nldagg@ucsb.edu\nLSB 4311\nStudent\nJohn Damuth\nResearch Biologist\ndamuth@lifesci.ucsb.edu\n805.729.4393\n4107 Life Sciences\nResearcher\nPaul Diaz\nPurchasing Manager\npdiaz@lifesci.ucsb.edu\n(805) 893-3234\nBio Receiving (Building 569) 1101\nStaff\nZhujin Mavis Ding\nGraduate Student\nzding@ucsb.edu\n805.893.xxxxx\nNobel 1109\nStudent\nCatherine Drake\nAcademic Coordinator\ncdrake@ucsb.edu\n805.893.3357\n1118 BSIF\nStaff\nJohn A. Endler\nResearch Professor\nJohn.Endler@jcu.edu.au\n+61 488255712\n\nFaculty\nChristopher Evelyn\nAssistant Researcher\nchristopher.evelyn@lifesci.ucsb.edu\n\nResearcher\nThomas Even\nSenior Lecturer\nProfessor\neven@lifesci.ucsb.edu\n805.893.2904\n4322 Life Sciences Building\nFaculty\nEric Fairbanks\nGraduate Student\nefairbanks@ucsb.edu\n805.893.xxxxx\nNoble Hall 1111\nStudent\nHalley Froehlich\nAssistant Professor\nhefroehlich@ucsb.edu\n805.893.7016\n4007 Bren Hall\nFaculty\nEddie Fuques-Villalba\nGraduate Student\neddiefuques-villalba@ucsb.edu\n805.893.xxxxx\nMSRB 2407\nStudent\nSteve Gaines\nProfessor Emeritus\ngaines@ucsb.edu\n805.893.7363\n2410 Bren Hall\nFaculty\nDevin Gamble\nGraduate Student\ndevin.gamble@lifesci.ucsb.edu\n\nStudent\nJames Gately\nPostdoc\njames.gately@lifesci.ucsb.edu\n805.893.xxxxx\n\nResearcher\nKenneth Gilliland\nGraduate Student\nkenneth.gilliland@lifesci.ucsb.edu\n1224 Noble Hall\nStudent\nPhoebe Hall\nGraduate Student\nphoebehall@ucsb.edu\n\nStudent\nSayward Halling\nIntro Bio Program Manager\nsayward.halling@lifesci.ucsb.edu\n805.893.3357\n1118 Biological Sciences Instructional Facility\nStaff\nCameron Hannah-Bick\nGreenhouse Manager\ncameron.hannah-bick@lifesci.ucsb.edu\n805.893.2867\n540 Greenhouse\nStaff\nRuby Harris-Gavin\nGraduate Student\nruby.harris-gavin@lifesci.ucsb.edu\n\nStudent\nScott Hodges\nProfessor\nhodges@lifesci.ucsb.edu\n805.893.7813\n4105 Life Sciences Building\nFaculty\nGretchen Hofmann\nProfessor\nhofmann@ucsb.edu\n805.893.6175\n4310 Marine Science Institute\nFaculty\nSally Holbrook\nResearch Professor\nholbrook@ucsb.edu\n805.893.3956\n3316 Marine Science Institute\nFaculty\nDébora Iglesias-Rodriguez\nProfessor\niglesias@lifesci.ucsb.edu\n805.893.4680\n3151 Marine Biotech\nFaculty\nAnna James\nAssistant Teaching Professor\najames@ucsb.edu\n\nFaculty\nSamantha Jerry\nGraduate Student\nsamanthajerry@ucsb.edu\n\nStudent\nAndrea Jorgensen\nManagement Services Officer\nandrea.jorgensen@lifesci.ucsb.edu\n805.893.2974\n4306 Life Sciences Building\nStaff\nMackenzie Kawahara\nGraduate Student\nmakawahara@ucsb.edu\n805.893.xxxxx\n\nStudent\nArmand Kuris\nProfessor\nkuris@lifesci.ucsb.edu\n805.893.3998\n2002 Marine Biotech\nFaculty\nKevin Lafferty\nAdjunct Faculty\nUS Geological Survey\nlafferty@lifesci.ucsb.edu\n805.893.8778\n2308 Marine Science Institute\nFaculty\nRyan Langlo\nShop Superintendent\nryan.langlo@lifesci.ucsb.edu\n(805) 893-7286\n1250A Bio Shop\nStaff\nSaru Lantier\nLab Coordinator\nStaff\nJohn Latto\nSenior Lecturer\njlatto@ucsb.edu\n805.893.5399\n4324 Life Sciences Building\nFaculty\nPiper Lovegreen\nGraduate Student\nplovegreen@ucsb.edu\n805.893.xxxxx\n\nStudent\nHannah Lyford\nGraduate Student\nhannahrlyford@ucsb.edu\nNoble Hall 1111\nStudent\nStephanie Ma\nGraduate Student\nstephanie.ma@lifesci.ucsb.edu\n1244 Noble Hall\nStudent\nSally MacIntyre\nProfessor\nsally@eri.ucsb.edu\n805.893.3951\n4308 Marine Science Institute\nFaculty\nBruce Mahall\nProfessor Emeritus\nmahall@lifesci.ucsb.edu\n\nFaculty\nHaley Martin\nDirector of Finance\nhaleymartin@ucsb.edu\n805-893-2427\n4308 Life Sciences Building\nStaff\nJesús Martínez-Gómez\nAssistant Professor\njesusgm@ucsb.edu\n\nFaculty\nSusan J. Mazer\nProfessor\nsjmazer@ucsb.edu\n805.893.8011\n4119 Life Sciences Building\nFaculty\nDouglas McCauley\nProfessor\ndmccauley@ucsb.edu\n805.893.2170\n2314 Marine Science Institute\nFaculty\nAdriane Mcdonald\nGraduate Student\nadriane.mcdonald@lifesci.ucsb.edu\n\nStudent\nSiena McKim\nGraduate Student\nsiena.mckim@lifesci.ucsb.edu\n\nStudent\nJohn M. Melack\nResearch Professor\njohn.melack@lifesci.ucsb.edu\n805.893.3879\n4424 Bren Hall\nFaculty\nAnna Mele\nGraduate Student\namele@ucsb.edu\n\nStudent\nHolly Moeller\nAssociate Professor\nholly.moeller@lifesci.ucsb.edu\n805.893.3216\n1120 Noble Hall\nFaculty\nNury Molina\nGraduate Student\nnury.molina@lifesci.ucsb.edu\n\nStudent\nWilliam Murdoch\nResearch Professor\nmurdoch@lifesci.ucsb.edu\n2108 Noble Hall\nFaculty\nAlice Nguyen\nAcademic Coordinator, Introductory Biology\nalicetn@ucsb.edu\n805.893.2679\n4326 Life Sciences Building\nStaff\nNick Nidzieko\nChair, IGPMS Earth Science\nAssociate Professor\nnidzieko@ucsb.edu\n+1 805-893-5674\n4316 MSRB / 5830 Ellison Hall\nFaculty\nRoger Nisbet\nResearch Professor\nrogernisbet@ucsb.edu\n2001 Noble Hall\nFaculty\nSekou Noble-Kuchera\nGraduate Student\nsekou@ucsb.edu\nBio II room 1139\nStudent\nCaitlin Nordheim\nGraduate Student\ncaitlinnordheim@lifesci.ucsb.edu\n\nStudent\nMichael (Mickey) O'Connell\nMarine Mechanician\nmichael.oconnell@lifesci.ucsb.edu\n805.893.7181\n1007 Marine Biotech\nStaff\nSibelle O'Donnell\nGraduate Student\nsibelleodonnell@ucsb.edu\nMSI 2407\nStudent\nTodd Oakley\nEEMB Department Chair\nProfessor\noakley@ucsb.edu\n805.893.4715\n4101 Life Sciences Building\nFaculty\nRyoko Oono\nAssociate Professor\nryoko.oono@lifesci.ucsb.edu\n805.893.5064\n1116 Noble Hall\nFaculty\nChristian Orsini\nAssistant Diver / Collector\nchristian.orsini@lifesci.ucsb.edu\n805.893.2873\n102 Building 465\nStaff\nSunni Patton\nGraduate Student\nsunni@ucsb.edu\n805.893.xxxxx\nMSRB 2407\nStudent\nOscar Perez\nLab Manager\nStaff\nDanielle Perez\nDepartmental Assistant\ndcperez@ucsb.edu\n805.893.3775\n4316 Life Sciences Building\nStaff\nFerdinand Pfab\nPostdoctoral Researcher\nferdinand.pfab@gmail.com\n2003 Noble Hall\nResearcher\nChristoph Pierre\nDirector of Marine Operations\nchristoph.pierre@lifesci.ucsb.edu\n805.893.2873\n102 Building 465\nStaff\nGwendolyn Pohlmann\nGraduate Student\ngwendolyn_pohlmann@ucsb.edu\n805.893.xxxxx\nNoble 1109\nStudent\nStephen Proulx\nEEMB Vice Chair, Curriculum\nProfessor\nsproul@ucsb.edu\n4109 Life Sciences Building\nFaculty\nJames Reichman\nProfessor Emeritus\noireichman@gmail.com\n805.892.2504\n\nFaculty\nJulianna Renzi\nGraduate Student\njulianna.renzi@lifesci.ucsb.edu\n\nStudent\nWilliam Rice\nResearch Professor\nrice@lifesci.ucsb.edu\n\nFaculty\nKacie Ring\nGraduate Student\nkacie.ring@lifesci.ucsb.edu\n\nStudent\nJoel Rothman\nProfessor\njoel.rothman@lifesci.ucsb.edu\n805.893.7885\n3137 Bio II\nFaculty\nSteve Rothstein\nResearch Professor\nrothstei@lifesci.ucsb.edu\n\nFaculty\nImani Russell\nGraduate Student\nimani.russell@lifesci.ucsb.edu\n\nStudent\nAlyson Santoro\nProfessor\nasantoro@ucsb.edu\n805.893.5318\n2155 Marine Biotech Lab\nFaculty\nJoshua Schimel\nProfessor\nschimel@lifesci.ucsb.edu\n805.893.7688\n1108 Noble Hall\nFaculty\nRussell Schmitt\nResearch Professor\nrussellschmitt@ucsb.edu\n805.893.2051\n3314 Marine Science Institute\nFaculty\nJoel Sharbrough\nAssistant Professor\njsharbro@ucsb.edu\n805-893-4432\n1123 Biological Sciences 2\nFaculty\nJackie Shay\nAssistant Teaching Professor\njshay@ucsb.edu\n4320 Life Sciences Building\nFaculty\nAllan Stewart-Oaten\nProfessor Emeritus\nstewart@lifesci.ucsb.edu\n\nFaculty\nAdrian Stier\nAssociate Professor\nastier@ucsb.edu\n805.893.5467\n2108 Noble Hall\nFaculty\nRaul Suarez\nProfessor Emeriti\nsuarez@lifesci.ucsb.edu\n119 Biology II\nFaculty\nSamuel Sweet\nProfessor\nsweet@lifesci.ucsb.edu\n805.893.3730\n1124 Noble Hall\nFaculty\nAudrey Thellman\nAssistant Professor of Freshwater Ecology\nathellman@ucsb.edu\nNoble Hall 1112\nFaculty\nCharlie Thrift\nGraduate Student\ncnthrift@ucsb.edu\n805.893.xxxxx\n\nStudent\nAndrew Thurber\nAssociate Professor\nathurber@ucsb.edu\nNoble Hall 2136\nFaculty\nNehir Toklu\nGraduate Student\nnehirtoklu@ucsb.edu\nLife Sciences Building 4210 and Bio 2 1139\nStudent\nThomas Turner\nAssociate Professor\ntturner@lifesci.ucsb.edu\n805.893.3798\n4103 Life Sciences\nFaculty\nRosa Vasquez\nAcademic Personnel Analyst\nrosavasquez@ucsb.edu\n805-893-7394\nLSB 4310\nStaff\nRebecca Vega Thurber\nProfessor; Director of UCSB Marine Science Institute\nrvegathurber@ucsb.edu\n805.893.xxxx\nMSRB 4326\nFaculty\nBridget Vincent\nGraduate Student\nbridget.vincent@lifesci.ucsb.edu\n\nStudent\nRobert Warner\nResearch Professor\nwarner@lifesci.ucsb.edu\n805.893.2941\n4322A Marine Science Institute\nFaculty\nMaddy Weise\nGraduate Student\nmweise@ucsb.edu\n805.893.xxxxx\nBio 2 room 1125\nStudent\nZoe Welch\nGraduate Student\nzoe.welch@lifesci.ucsb.edu\n1119 Marine Biotech\nStudent\nAdrian M. Wenner\nProfessor Emeritus\nwenner@lifesci.ucsb.edu\n\nFaculty\nPatrick White\nShop Assistant\nStaff\nLizzy Wilbanks\nAssistant Professor\nelizabeth.wilbanks@lifesci.ucsb.edu\n2128 Noble Hall\nFaculty\nEllery Wilkie\nUndergraduate Academic Advisor\newilkie@lifesci.ucsb.edu\n3318 Life Sciences Building\nStaff\nMengshu Ye\nStaff Graduate Advisor\nmengshuye@ucsb.edu\n805-893-3043\n4310 Life Sciences Building\nStaff\nSoojin Yi\nProfessor\nsoojinyi@ucsb.edu\n4107 Life Science Building\nFaculty\nHillary Young\nEEMB Vice Chair, Resources\nProfessor\nhillary.young@lifesci.ucsb.edu\n805.893.4681\n2116 Noble Hall\nFaculty\nYong Zhou\nAssistant Professor\nyongzhou@ucsb.edu\nBio II Room 1121\nFaculty\nLeadership\nTodd Oakley\nEEMB Department Chair\nProfessor\n  \n4101 Life Sciences Building\nHillary Young\nEEMB Vice Chair, Resources\nProfessor\n  \n2116 Noble Hall\nStephen Proulx\nEEMB Vice Chair, Curriculum\nProfessor\n \n4109 Life Sciences Building\nDepartment Administration\n\nAcademic Business Officer\nAndrea Jorgensen\namjorgen@ucsb.edu\n\nAcademic Personnel\nRosa Vasquez\nrosavasquez@ucsb.edu\n\nDepartmental Assistant\nDanielle Perez\ndcperez@ucsb.edu\n\nDirector of Finance\nHaley Martin\nhaleymartin@ucsb.edu\n\nStaff Graduate Advisor\nMengshu Ye\nmengshuye@ucsb.edu\n\nUndergraduate Advisor\nEllery Wilkie\newilkie@lifesci.ucsb.edu\n\nConference Rooms\n4164 Bio 2 (Clarke Carbon)\n4301 Life Sciences\n4307 Life Sciences\n3103 Marine Biotechnology\n1231 Noble Hall\n2221 Noble Hall\nMailing Address\n\nEcology, Evolution, and Marine Biology\nUniversity of California, Santa Barbara\nSanta Barbara, CA 93106-9620\n\nContact Us\n 805.893.2974\n info@eemb.ucsb.edu\n Jobs\n Visit EEMB\nSupport Services\n Administration\n Room Reservations\n Research Services\nTechnical Support\nShipping / Receiving\nWebsite\n Information\n Terms of Use\n Privacy\n Login\n  \n\nEcology, Evolution, and Marine Biology\nUniversity of California, Santa Barbara\n© 2025 Regents of the University of California",
        "headings": [
          {
            "level": "H2",
            "text": "Main navigation"
          },
          {
            "level": "H1",
            "text": "People"
          },
          {
            "level": "H2",
            "text": "Primary tabs"
          },
          {
            "level": "H3",
            "text": "Alice Alldredge"
          },
          {
            "level": "H3",
            "text": "Evelin Ambrocio-Silva"
          },
          {
            "level": "H3",
            "text": "Leander Anderegg"
          },
          {
            "level": "H3",
            "text": "Ivanna Arrizon Elizarraras"
          },
          {
            "level": "H3",
            "text": "Daniel Botkin"
          },
          {
            "level": "H3",
            "text": "Cherie Briggs"
          },
          {
            "level": "H3",
            "text": "Mark Brzezinski"
          },
          {
            "level": "H3",
            "text": "An Bui"
          },
          {
            "level": "H3",
            "text": "Deron Burkepile"
          },
          {
            "level": "H3",
            "text": "Craig Carlson"
          },
          {
            "level": "H3",
            "text": "Jenn Caselle"
          },
          {
            "level": "H3",
            "text": "Noe Castaneda"
          },
          {
            "level": "H3",
            "text": "Braulio Castillo"
          },
          {
            "level": "H3",
            "text": "Joe Celebrezze"
          },
          {
            "level": "H3",
            "text": "James Childress"
          },
          {
            "level": "H3",
            "text": "Ivia Closset"
          },
          {
            "level": "H3",
            "text": "Peter Collins"
          },
          {
            "level": "H3",
            "text": "Scott D. Cooper"
          },
          {
            "level": "H3",
            "text": "Carla D'Antonio"
          },
          {
            "level": "H3",
            "text": "Laura Dagg"
          },
          {
            "level": "H3",
            "text": "John Damuth"
          },
          {
            "level": "H3",
            "text": "Paul Diaz"
          },
          {
            "level": "H3",
            "text": "Zhujin Mavis Ding"
          },
          {
            "level": "H3",
            "text": "Catherine Drake"
          },
          {
            "level": "H3",
            "text": "John A. Endler"
          },
          {
            "level": "H3",
            "text": "Christopher Evelyn"
          },
          {
            "level": "H3",
            "text": "Thomas Even"
          },
          {
            "level": "H3",
            "text": "Eric Fairbanks"
          },
          {
            "level": "H3",
            "text": "Halley Froehlich"
          },
          {
            "level": "H3",
            "text": "Eddie Fuques-Villalba"
          },
          {
            "level": "H3",
            "text": "Steve Gaines"
          },
          {
            "level": "H3",
            "text": "Devin Gamble"
          },
          {
            "level": "H3",
            "text": "James Gately"
          },
          {
            "level": "H3",
            "text": "Kenneth Gilliland"
          },
          {
            "level": "H3",
            "text": "Phoebe Hall"
          },
          {
            "level": "H3",
            "text": "Sayward Halling"
          },
          {
            "level": "H3",
            "text": "Cameron Hannah-Bick"
          },
          {
            "level": "H3",
            "text": "Ruby Harris-Gavin"
          },
          {
            "level": "H3",
            "text": "Scott Hodges"
          },
          {
            "level": "H3",
            "text": "Gretchen Hofmann"
          },
          {
            "level": "H3",
            "text": "Sally Holbrook"
          },
          {
            "level": "H3",
            "text": "Débora Iglesias-Rodriguez"
          },
          {
            "level": "H3",
            "text": "Anna James"
          },
          {
            "level": "H3",
            "text": "Samantha Jerry"
          },
          {
            "level": "H3",
            "text": "Andrea Jorgensen"
          },
          {
            "level": "H3",
            "text": "Mackenzie Kawahara"
          },
          {
            "level": "H3",
            "text": "Armand Kuris"
          },
          {
            "level": "H3",
            "text": "Kevin Lafferty"
          },
          {
            "level": "H3",
            "text": "Ryan Langlo"
          },
          {
            "level": "H3",
            "text": "Saru Lantier"
          },
          {
            "level": "H3",
            "text": "John Latto"
          },
          {
            "level": "H3",
            "text": "Piper Lovegreen"
          },
          {
            "level": "H3",
            "text": "Hannah Lyford"
          },
          {
            "level": "H3",
            "text": "Stephanie Ma"
          },
          {
            "level": "H3",
            "text": "Sally MacIntyre"
          },
          {
            "level": "H3",
            "text": "Bruce Mahall"
          },
          {
            "level": "H3",
            "text": "Haley Martin"
          },
          {
            "level": "H3",
            "text": "Jesús Martínez-Gómez"
          },
          {
            "level": "H3",
            "text": "Susan J. Mazer"
          },
          {
            "level": "H3",
            "text": "Douglas McCauley"
          },
          {
            "level": "H3",
            "text": "Adriane Mcdonald"
          },
          {
            "level": "H3",
            "text": "Siena McKim"
          },
          {
            "level": "H3",
            "text": "John M. Melack"
          },
          {
            "level": "H3",
            "text": "Anna Mele"
          },
          {
            "level": "H3",
            "text": "Holly Moeller"
          },
          {
            "level": "H3",
            "text": "Nury Molina"
          },
          {
            "level": "H3",
            "text": "William Murdoch"
          },
          {
            "level": "H3",
            "text": "Alice Nguyen"
          },
          {
            "level": "H3",
            "text": "Nick Nidzieko"
          },
          {
            "level": "H3",
            "text": "Roger Nisbet"
          },
          {
            "level": "H3",
            "text": "Sekou Noble-Kuchera"
          },
          {
            "level": "H3",
            "text": "Caitlin Nordheim"
          },
          {
            "level": "H3",
            "text": "Michael (Mickey) O'Connell"
          },
          {
            "level": "H3",
            "text": "Sibelle O'Donnell"
          },
          {
            "level": "H3",
            "text": "Todd Oakley"
          },
          {
            "level": "H3",
            "text": "Ryoko Oono"
          },
          {
            "level": "H3",
            "text": "Christian Orsini"
          },
          {
            "level": "H3",
            "text": "Sunni Patton"
          },
          {
            "level": "H3",
            "text": "Oscar Perez"
          },
          {
            "level": "H3",
            "text": "Danielle Perez"
          },
          {
            "level": "H3",
            "text": "Ferdinand Pfab"
          },
          {
            "level": "H3",
            "text": "Christoph Pierre"
          },
          {
            "level": "H3",
            "text": "Gwendolyn Pohlmann"
          },
          {
            "level": "H3",
            "text": "Stephen Proulx"
          },
          {
            "level": "H3",
            "text": "James Reichman"
          },
          {
            "level": "H3",
            "text": "Julianna Renzi"
          },
          {
            "level": "H3",
            "text": "William Rice"
          },
          {
            "level": "H3",
            "text": "Kacie Ring"
          },
          {
            "level": "H3",
            "text": "Joel Rothman"
          },
          {
            "level": "H3",
            "text": "Steve Rothstein"
          },
          {
            "level": "H3",
            "text": "Imani Russell"
          },
          {
            "level": "H3",
            "text": "Alyson Santoro"
          },
          {
            "level": "H3",
            "text": "Joshua Schimel"
          },
          {
            "level": "H3",
            "text": "Russell Schmitt"
          },
          {
            "level": "H3",
            "text": "Joel Sharbrough"
          },
          {
            "level": "H3",
            "text": "Jackie Shay"
          },
          {
            "level": "H3",
            "text": "Allan Stewart-Oaten"
          },
          {
            "level": "H3",
            "text": "Adrian Stier"
          },
          {
            "level": "H3",
            "text": "Raul Suarez"
          },
          {
            "level": "H3",
            "text": "Samuel Sweet"
          },
          {
            "level": "H3",
            "text": "Audrey Thellman"
          },
          {
            "level": "H3",
            "text": "Charlie Thrift"
          },
          {
            "level": "H3",
            "text": "Andrew Thurber"
          },
          {
            "level": "H3",
            "text": "Nehir Toklu"
          },
          {
            "level": "H3",
            "text": "Thomas Turner"
          },
          {
            "level": "H3",
            "text": "Rosa Vasquez"
          },
          {
            "level": "H3",
            "text": "Rebecca Vega Thurber"
          },
          {
            "level": "H3",
            "text": "Bridget Vincent"
          },
          {
            "level": "H3",
            "text": "Robert Warner"
          },
          {
            "level": "H3",
            "text": "Maddy Weise"
          },
          {
            "level": "H3",
            "text": "Zoe Welch"
          },
          {
            "level": "H3",
            "text": "Adrian M. Wenner"
          },
          {
            "level": "H3",
            "text": "Patrick White"
          },
          {
            "level": "H3",
            "text": "Lizzy Wilbanks"
          },
          {
            "level": "H3",
            "text": "Ellery Wilkie"
          },
          {
            "level": "H3",
            "text": "Mengshu Ye"
          },
          {
            "level": "H3",
            "text": "Soojin Yi"
          },
          {
            "level": "H3",
            "text": "Hillary Young"
          },
          {
            "level": "H3",
            "text": "Yong Zhou"
          },
          {
            "level": "H2",
            "text": "Leadership"
          },
          {
            "level": "H3",
            "text": "Todd Oakley"
          },
          {
            "level": "H3",
            "text": "Hillary Young"
          },
          {
            "level": "H3",
            "text": "Stephen Proulx"
          },
          {
            "level": "H2",
            "text": "Department Administration"
          },
          {
            "level": "H2",
            "text": "Conference Rooms"
          },
          {
            "level": "H2",
            "text": "Mailing Address"
          },
          {
            "level": "H2",
            "text": "Contact Us"
          },
          {
            "level": "H2",
            "text": "Support Services"
          },
          {
            "level": "H2",
            "text": "Website"
          }
        ],
        "peopleLinks": [
          {
            "name": "Evelin Ambrocio-Silva",
            "url": "https://www.eemb.ucsb.edu/people/staff/ambrocio-silva"
          },
          {
            "name": "Leander Anderegg",
            "url": "https://www.eemb.ucsb.edu/people/faculty/anderegg"
          },
          {
            "name": "Cherie Briggs",
            "url": "https://www.eemb.ucsb.edu/people/faculty/briggs"
          },
          {
            "name": "Deron Burkepile",
            "url": "https://www.eemb.ucsb.edu/people/faculty/burkepile"
          },
          {
            "name": "Ivia Closset",
            "url": "https://www.eemb.ucsb.edu/people/researchers/closset"
          },
          {
            "name": "Carla D'Antonio",
            "url": "https://www.eemb.ucsb.edu/people/faculty/dantonio"
          },
          {
            "name": "John Damuth",
            "url": "https://www.eemb.ucsb.edu/people/researchers/damuth"
          },
          {
            "name": "Paul Diaz",
            "url": "https://www.eemb.ucsb.edu/people/staff/diaz"
          },
          {
            "name": "Catherine Drake",
            "url": "https://www.eemb.ucsb.edu/people/staff/drake"
          },
          {
            "name": "Christopher Evelyn",
            "url": "https://www.eemb.ucsb.edu/people/researchers/evelyn"
          },
          {
            "name": "Thomas Even",
            "url": "https://www.eemb.ucsb.edu/people/faculty/even"
          },
          {
            "name": "Halley Froehlich",
            "url": "https://www.eemb.ucsb.edu/people/faculty/froehlich"
          },
          {
            "name": "James Gately",
            "url": "https://www.eemb.ucsb.edu/people/researchers/gately"
          },
          {
            "name": "Sayward Halling",
            "url": "https://www.eemb.ucsb.edu/people/staff/halling"
          },
          {
            "name": "Cameron Hannah-Bick",
            "url": "https://www.eemb.ucsb.edu/people/staff/hannah-bick"
          },
          {
            "name": "Scott Hodges",
            "url": "https://www.eemb.ucsb.edu/people/faculty/hodges"
          },
          {
            "name": "Gretchen Hofmann",
            "url": "https://www.eemb.ucsb.edu/people/faculty/hofmann"
          },
          {
            "name": "Débora Iglesias-Rodriguez",
            "url": "https://www.eemb.ucsb.edu/people/faculty/iglesias-rodriguez"
          },
          {
            "name": "Anna James",
            "url": "https://www.eemb.ucsb.edu/people/faculty/james-0"
          },
          {
            "name": "Andrea Jorgensen",
            "url": "https://www.eemb.ucsb.edu/people/staff/jorgensen"
          },
          {
            "name": "Armand Kuris",
            "url": "https://www.eemb.ucsb.edu/people/faculty/kuris"
          },
          {
            "name": "Ryan Langlo",
            "url": "https://www.eemb.ucsb.edu/people/staff/langlo"
          },
          {
            "name": "Saru Lantier",
            "url": "https://www.eemb.ucsb.edu/people/staff/lantier"
          },
          {
            "name": "John Latto",
            "url": "https://www.eemb.ucsb.edu/people/faculty/latto"
          },
          {
            "name": "Sally MacIntyre",
            "url": "https://www.eemb.ucsb.edu/people/faculty/macintyre"
          },
          {
            "name": "Haley Martin",
            "url": "https://www.eemb.ucsb.edu/people/staff/martin"
          },
          {
            "name": "Jesús Martínez-Gómez",
            "url": "https://www.eemb.ucsb.edu/people/faculty/martinez-gomez"
          },
          {
            "name": "Susan J. Mazer",
            "url": "https://www.eemb.ucsb.edu/people/faculty/mazer"
          },
          {
            "name": "Douglas McCauley",
            "url": "https://www.eemb.ucsb.edu/people/faculty/mccauley"
          },
          {
            "name": "Holly Moeller",
            "url": "https://www.eemb.ucsb.edu/people/faculty/moeller"
          },
          {
            "name": "Alice Nguyen",
            "url": "https://www.eemb.ucsb.edu/people/staff/nguyen"
          },
          {
            "name": "Nick Nidzieko",
            "url": "https://www.eemb.ucsb.edu/people/faculty/nidzieko"
          },
          {
            "name": "Michael (Mickey) O'Connell",
            "url": "https://www.eemb.ucsb.edu/people/staff/oconnell"
          },
          {
            "name": "Todd Oakley",
            "url": "https://www.eemb.ucsb.edu/people/faculty/oakley"
          },
          {
            "name": "Ryoko Oono",
            "url": "https://www.eemb.ucsb.edu/people/faculty/oono"
          },
          {
            "name": "Christian Orsini",
            "url": "https://www.eemb.ucsb.edu/people/staff/orsini"
          },
          {
            "name": "Oscar Perez",
            "url": "https://www.eemb.ucsb.edu/people/staff/perez"
          },
          {
            "name": "Danielle Perez",
            "url": "https://www.eemb.ucsb.edu/people/staff/dcperez"
          },
          {
            "name": "Ferdinand Pfab",
            "url": "https://www.eemb.ucsb.edu/people/researchers/pfab"
          },
          {
            "name": "Christoph Pierre",
            "url": "https://www.eemb.ucsb.edu/people/staff/pierre"
          },
          {
            "name": "Stephen Proulx",
            "url": "https://www.eemb.ucsb.edu/people/faculty/proulx"
          },
          {
            "name": "Joel Rothman",
            "url": "https://www.eemb.ucsb.edu/people/faculty/rothman"
          },
          {
            "name": "Alyson Santoro",
            "url": "https://www.eemb.ucsb.edu/people/faculty/santoro"
          },
          {
            "name": "Joshua Schimel",
            "url": "https://www.eemb.ucsb.edu/people/faculty/schimel"
          },
          {
            "name": "Joel Sharbrough",
            "url": "https://www.eemb.ucsb.edu/people/faculty/sharbrough"
          },
          {
            "name": "Jackie Shay",
            "url": "https://www.eemb.ucsb.edu/people/faculty/shay"
          },
          {
            "name": "Adrian Stier",
            "url": "https://www.eemb.ucsb.edu/people/faculty/stier"
          },
          {
            "name": "Samuel Sweet",
            "url": "https://www.eemb.ucsb.edu/people/faculty/sweet"
          },
          {
            "name": "Audrey Thellman",
            "url": "https://www.eemb.ucsb.edu/people/faculty/thellman"
          },
          {
            "name": "Andrew Thurber",
            "url": "https://www.eemb.ucsb.edu/people/faculty/thurber"
          },
          {
            "name": "Thomas Turner",
            "url": "https://www.eemb.ucsb.edu/people/faculty/turner"
          },
          {
            "name": "Rosa Vasquez",
            "url": "https://www.eemb.ucsb.edu/people/staff/vasquez"
          },
          {
            "name": "Rebecca Vega Thurber",
            "url": "https://www.eemb.ucsb.edu/people/faculty/vega-thurber"
          },
          {
            "name": "Patrick White",
            "url": "https://www.eemb.ucsb.edu/people/staff/white"
          },
          {
            "name": "Lizzy Wilbanks",
            "url": "https://www.eemb.ucsb.edu/people/faculty/wilbanks"
          },
          {
            "name": "Ellery Wilkie",
            "url": "https://www.eemb.ucsb.edu/people/staff/wilkie"
          },
          {
            "name": "Mengshu Ye",
            "url": "https://www.eemb.ucsb.edu/people/staff/ye"
          },
          {
            "name": "Soojin Yi",
            "url": "https://www.eemb.ucsb.edu/people/faculty/yi"
          },
          {
            "name": "Hillary Young",
            "url": "https://www.eemb.ucsb.edu/people/faculty/young"
          },
          {
            "name": "Yong Zhou",
            "url": "https://www.eemb.ucsb.edu/people/faculty/zhou"
          }
        ]
      }
    },
    {
      "name": "Faculty",
      "url": "https://www.eemb.ucsb.edu/people/faculty",
      "status": 200,
      "screenshot": "/Users/adrianstiermbp2023/eemb-website-redesign-2025-2026/docs/people-scrape-results/screenshots/faculty.png",
      "data": {
        "fullText": "Skip to main content\nMain navigation\nAbout\nPeople\nResearch\nAcademics \nNews\nEvents\nSupport \nGive\nPeople\nPrimary tabs\nFull Directory\nFaculty\n(active tab)\nAdjunct\nEmeriti\nStaff\nResearch Scientists\nStudents\nLeadership\nName\n \nFilter by\n- Any -\nAquatic Biology\nBehavior\nBiological Oceanography\nBotany\nDisease Ecology\nEcological and Evolutionary Physiology\nEcology\nEcosystem Ecology\nEvolution\nEvolutionary Ecology\nEvolutionary Genetics\nLimnology\nMacroevolution\nMarine Biology\nMicrobial Ecology\nOrganismal Biology\nPopulation and Community Ecology\nZoology\n Apply\nLeander Anderegg\nAssistant Professor\n   \n\nPlant ecophysiology, community ecology and biogeography. Ecological responses to climate change.\nBotany\nEcological and Evolutionary Physiology\nEcology\nEcosystem Ecology\nOrganismal Biology\nPopulation and Community Ecology\nCherie Briggs\nProfessor\n   \n2112 Noble Hall\nDr. Briggs’ research combines modeling and experiments to understand the factors affecting the dynamics of animal populations.\nDisease Ecology\nEcology\nPopulation and Community Ecology\nDeron Burkepile\nProfessor\n   \n4312 Marine Science Institute\nMarine ecology, community ecology, trophic interactions, coral reefs.\nBehavior\nEcosystem Ecology\nMarine Biology\nPopulation and Community Ecology\nZoology\nCarla D'Antonio\nProfessor\n   \n4002 Bren Hall\nTerrestrial plant community and ecosystem ecology, controls over vegetation change, feedbacks, restoration ecology.\nBotany\nEcology\nEcosystem Ecology\nPopulation and Community Ecology\nThomas Even\nSenior Lecturer\nProfessor\n \n4322 Life Sciences Building\nPopulation and community ecology, river ecology, predator-prey interactions, science education.\nAquatic Biology\nEcology\nLimnology\nOrganismal Biology\nPopulation and Community Ecology\nHalley Froehlich\nAssistant Professor\n    \n4007 Bren Hall\nThe Froehlich Lab studies the sustainability of seafood and marine ecosystems under climate change.\nBehavior\nEcological and Evolutionary Physiology\nEcology\nMarine Biology\nPopulation and Community Ecology\nScott Hodges\nProfessor\n  \n4105 Life Sciences Building\nOur laboratory studies the genetic basis of adaptation and speciation using genomic analyses and field-based studies in the genus Aquilegia (Columbines).\nBotany\nEcology\nEvolution\nEvolutionary Ecology\nEvolutionary Genetics\nMacroevolution\nOrganismal Biology\nGretchen Hofmann\nProfessor\n   \n4310 Marine Science Institute\nGlobal change biology and marine physiology.\nEcological and Evolutionary Physiology\nMarine Biology\nOrganismal Biology\nDébora Iglesias-Rodriguez\nProfessor\n  \n3151 Marine Biotech\nDebora Iglesias-Rodriguez has worked for twenty years on diversity and function in marine phytoplankton combining molecular approaches, carbon physiology and biogeochemistry in the lab and in the field.\nAquatic Biology\nBiological Oceanography\nEcological and Evolutionary Physiology\nEcology\nEcosystem Ecology\nMarine Biology\nMicrobial Ecology\nPopulation and Community Ecology\nAnna James\nAssistant Teaching Professor\n\n\n\nHow students think and learn in large, introductory STEM courses and the effects of climate change on marine microbia\n\nArmand Kuris\nProfessor\n   \n2002 Marine Biotech\nThe mission of our research group is to reveal the role of infectious diseases in ecosystems. We investigate parasite ecology, disease ecology, food web dynamics, ecology and evolution of infectious strategies, and control of human parasites.\nAquatic Biology\nDisease Ecology\nEcology\nEcosystem Ecology\nEvolutionary Ecology\nMarine Biology\nOrganismal Biology\nPopulation and Community Ecology\nZoology\nJohn Latto\nSenior Lecturer\n \n4324 Life Sciences Building\n\nPopulation and community ecology; host-parasitoid interactions.\n\nSally MacIntyre\nProfessor\n  \n4308 Marine Science Institute\nLimnology and Coastal Oceanography, with particular emphasis on physical-biological coupling.\nAquatic Biology\nEcology\nEcosystem Ecology\nLimnology\nJesús Martínez-Gómez\nAssistant Professor\n \n\nOur lab studies the evolutionary and developmental origin of plant structures.\nBotany\nEvolution\nEvolutionary Genetics\nMacroevolution\nOrganismal Biology\nSusan J. Mazer\nProfessor\n   \n4119 Life Sciences Building\nQuantitative evolutionary genetics, mating system evolution, adaptation, pollination ecology, and floral evolution.\nBotany\nEcology\nEvolution\nEvolutionary Ecology\nEvolutionary Genetics\nOrganismal Biology\nPopulation and Community Ecology\nDouglas McCauley\nProfessor\n   \n2314 Marine Science Institute\nEcology; Conservation Science.\nBehavior\nEcosystem Ecology\nMarine Biology\nPopulation and Community Ecology\nZoology\nHolly Moeller\nAssociate Professor\n   \n1120 Noble Hall\nUses mathematics, experiments, and field observations to understand how metabolic interactions between species shape the structure and function of ecological communities.\nBiological Oceanography\nMicrobial Ecology\nPopulation and Community Ecology\nNick Nidzieko\nChair, IGPMS Earth Science\nAssociate Professor\n \n4316 MSRB / 5830 Ellison Hall\n\nI am a coastal physical oceanographer.\n\nTodd Oakley\nEEMB Department Chair\nProfessor\n   \n4101 Life Sciences Building\nMacroevolution, phylogenetics, bioluminescence, vision, molecular evolution, complexity, marine organismal biology.\nAquatic Biology\nBehavior\nEcological and Evolutionary Physiology\nEvolution\nEvolutionary Ecology\nEvolutionary Genetics\nMacroevolution\nMarine Biology\nOrganismal Biology\nZoology\nRyoko Oono\nAssociate Professor\n   \n1116 Noble Hall\nPlant-microbe evolution and ecology, microbial species diversity and taxonomy, evolution of symbiosis.\nBotany\nEvolutionary Ecology\nEvolutionary Genetics\nMicrobial Ecology\nPopulation and Community Ecology\nStephen Proulx\nEEMB Vice Chair, Curriculum\nProfessor\n   \n4109 Life Sciences Building\nMathematical theory of evolutionary and eco-evolutionary processes.\nBehavior\nEvolution\nEvolutionary Ecology\nEvolutionary Genetics\nJoel Rothman\nProfessor\n   \n3137 Bio II\nEvolutionary and quantitative genetics of development, robustness and fidelity of complex systems, interstellar biology.\nBehavior\nEcological and Evolutionary Physiology\nEvolution\nEvolutionary Genetics\nMacroevolution\nOrganismal Biology\nZoology\nAlyson Santoro\nProfessor\n   \n2155 Marine Biotech Lab\nMarine microbial ecology, nitrogen cycling.\nBiological Oceanography\nEcosystem Ecology\nEvolutionary Ecology\nMicrobial Ecology\nPopulation and Community Ecology\nJoshua Schimel\nProfessor\n   \n1108 Noble Hall\nSoil and ecosystem ecology, microbial ecology, nutrient cycling, soil organic matter.\nBotany\nEcology\nEcosystem Ecology\nMicrobial Ecology\nOrganismal Biology\nJoel Sharbrough\nAssistant Professor\n   \n1123 Biological Sciences 2\n\nResearch Interests: Evolutionary genomics, polyploidy, mitochondria, chloroplasts, respiration, photosynthesis\n\nAquatic Biology\nBotany\nEcological and Evolutionary Physiology\nEvolution\nEvolutionary Genetics\nOrganismal Biology\nZoology\nJackie Shay\nAssistant Teaching Professor\n  \n4320 Life Sciences Building\nJoy-centered pedagogy in biology education, teacher professional development, epistemologies in STEM, accessible course-based research experiences, and all things fungal.\nEcology\nEcosystem Ecology\nEvolutionary Ecology\nMicrobial Ecology\nOrganismal Biology\nPopulation and Community Ecology\nAdrian Stier\nAssociate Professor\n    \n2108 Noble Hall\nOcean Resilience: biodiversity, assembly, and sustainability of harvested ocean ecosystems.\nAquatic Biology\nEcology\nMarine Biology\nPopulation and Community Ecology\nSamuel Sweet\nProfessor\n  \n1124 Noble Hall\nDistributional ecology and systematics of western North American and Australian amphibians and reptiles; ecology and systematics of monitor lizards; mechanics of intergrade zones and of speciational processes; crypsis; functional and evolutionary morphology; ethnozoology; conservation biology.\nBehavior\nEvolution\nEvolutionary Ecology\nMacroevolution\nOrganismal Biology\nPopulation and Community Ecology\nZoology\nAudrey Thellman\nAssistant Professor of Freshwater Ecology\n\nNoble Hall 1112\n\nClimate change is fundamentally altering the quantity and quality of freshwaters on the planet.\n\nEcology\nEcosystem Ecology\nAndrew Thurber\nAssociate Professor\n  \nNoble Hall 2136\n\nMy research focuses on how deep-sea and polar communities function.  These areas cover well over 63 percent of the gl\n\nAquatic Biology\nBiological Oceanography\nEcology\nEcosystem Ecology\nMarine Biology\nMicrobial Ecology\nOrganismal Biology\nPopulation and Community Ecology\nZoology\nThomas Turner\nAssociate Professor\n   \n4103 Life Sciences\nWe seek to understand the genetic basis of behavioral variation by combining population genetics and neurobiology in Drosophila and other species.\nEvolution\nEvolutionary Genetics\nMarine Biology\nZoology\nRebecca Vega Thurber\nProfessor; Director of UCSB Marine Science Institute\n  \nMSRB 4326\nOur lab studies the microbial and viral ecology of marine and terrestrial species. We also conduct work specifically on marine conservation, aiming to better evaluate the unseen biodiversity of marine systems and to identify innovative solutions to the global declines of key marine species.\nDisease Ecology\nMarine Biology\nMicrobial Ecology\nLizzy Wilbanks\nAssistant Professor\n  \n2128 Noble Hall\nI am interested how microbial interactions and tightly-coupled biogeochemical cycles drive the ecological and evolutionary dynamics of populations, with a current focus on the bacteria and archaea of marine aggregates and biofilms.\nBiological Oceanography\nEcosystem Ecology\nEvolutionary Ecology\nMicrobial Ecology\nPopulation and Community Ecology\nSoojin Yi\nProfessor\n  \n4107 Life Science Building\nAn evolutionary biologist using genomic and epigenomic tools to study regulatory evolution.\nEvolution\nEvolutionary Ecology\nEvolutionary Genetics\nMarine Biology\nZoology\nHillary Young\nEEMB Vice Chair, Resources\nProfessor\n   \n2116 Noble Hall\nCommunity ecology, conservation biology, global change biology, disease ecology, food-web ecology.\nDisease Ecology\nEcology\nPopulation and Community Ecology\nZoology\nYong Zhou\nAssistant Professor\n  \nBio II Room 1121\n\nOur lab investigates how ecosystem processes respond to global change, with a particular focus on carbon and nutrient\n\nEcology\nEcosystem Ecology\nMicrobial Ecology\nPopulation and Community Ecology\nContact Us\n 805.893.2974\n info@eemb.ucsb.edu\n Jobs\n Visit EEMB\nSupport Services\n Administration\n Room Reservations\n Research Services\nTechnical Support\nShipping / Receiving\nWebsite\n Information\n Terms of Use\n Privacy\n Login\n  \n\nEcology, Evolution, and Marine Biology\nUniversity of California, Santa Barbara\n© 2025 Regents of the University of California",
        "headings": [
          {
            "level": "H2",
            "text": "Main navigation"
          },
          {
            "level": "H1",
            "text": "People"
          },
          {
            "level": "H2",
            "text": "Primary tabs"
          },
          {
            "level": "H3",
            "text": "Leander Anderegg"
          },
          {
            "level": "H3",
            "text": "Cherie Briggs"
          },
          {
            "level": "H3",
            "text": "Deron Burkepile"
          },
          {
            "level": "H3",
            "text": "Carla D'Antonio"
          },
          {
            "level": "H3",
            "text": "Thomas Even"
          },
          {
            "level": "H3",
            "text": "Halley Froehlich"
          },
          {
            "level": "H3",
            "text": "Scott Hodges"
          },
          {
            "level": "H3",
            "text": "Gretchen Hofmann"
          },
          {
            "level": "H3",
            "text": "Débora Iglesias-Rodriguez"
          },
          {
            "level": "H3",
            "text": "Anna James"
          },
          {
            "level": "H3",
            "text": "Armand Kuris"
          },
          {
            "level": "H3",
            "text": "John Latto"
          },
          {
            "level": "H3",
            "text": "Sally MacIntyre"
          },
          {
            "level": "H3",
            "text": "Jesús Martínez-Gómez"
          },
          {
            "level": "H3",
            "text": "Susan J. Mazer"
          },
          {
            "level": "H3",
            "text": "Douglas McCauley"
          },
          {
            "level": "H3",
            "text": "Holly Moeller"
          },
          {
            "level": "H3",
            "text": "Nick Nidzieko"
          },
          {
            "level": "H3",
            "text": "Todd Oakley"
          },
          {
            "level": "H3",
            "text": "Ryoko Oono"
          },
          {
            "level": "H3",
            "text": "Stephen Proulx"
          },
          {
            "level": "H3",
            "text": "Joel Rothman"
          },
          {
            "level": "H3",
            "text": "Alyson Santoro"
          },
          {
            "level": "H3",
            "text": "Joshua Schimel"
          },
          {
            "level": "H3",
            "text": "Joel Sharbrough"
          },
          {
            "level": "H3",
            "text": "Jackie Shay"
          },
          {
            "level": "H3",
            "text": "Adrian Stier"
          },
          {
            "level": "H3",
            "text": "Samuel Sweet"
          },
          {
            "level": "H3",
            "text": "Audrey Thellman"
          },
          {
            "level": "H3",
            "text": "Andrew Thurber"
          },
          {
            "level": "H3",
            "text": "Thomas Turner"
          },
          {
            "level": "H3",
            "text": "Rebecca Vega Thurber"
          },
          {
            "level": "H3",
            "text": "Lizzy Wilbanks"
          },
          {
            "level": "H3",
            "text": "Soojin Yi"
          },
          {
            "level": "H3",
            "text": "Hillary Young"
          },
          {
            "level": "H3",
            "text": "Yong Zhou"
          },
          {
            "level": "H2",
            "text": "Contact Us"
          },
          {
            "level": "H2",
            "text": "Support Services"
          },
          {
            "level": "H2",
            "text": "Website"
          }
        ],
        "peopleLinks": [
          {
            "name": "Leander Anderegg",
            "url": "https://www.eemb.ucsb.edu/people/faculty/anderegg"
          },
          {
            "name": "Cherie Briggs",
            "url": "https://www.eemb.ucsb.edu/people/faculty/briggs"
          },
          {
            "name": "Deron Burkepile",
            "url": "https://www.eemb.ucsb.edu/people/faculty/burkepile"
          },
          {
            "name": "Carla D'Antonio",
            "url": "https://www.eemb.ucsb.edu/people/faculty/dantonio"
          },
          {
            "name": "Thomas Even",
            "url": "https://www.eemb.ucsb.edu/people/faculty/even"
          },
          {
            "name": "Halley Froehlich",
            "url": "https://www.eemb.ucsb.edu/people/faculty/froehlich"
          },
          {
            "name": "Scott Hodges",
            "url": "https://www.eemb.ucsb.edu/people/faculty/hodges"
          },
          {
            "name": "Gretchen Hofmann",
            "url": "https://www.eemb.ucsb.edu/people/faculty/hofmann"
          },
          {
            "name": "Débora Iglesias-Rodriguez",
            "url": "https://www.eemb.ucsb.edu/people/faculty/iglesias-rodriguez"
          },
          {
            "name": "Anna James",
            "url": "https://www.eemb.ucsb.edu/people/faculty/james-0"
          },
          {
            "name": "Armand Kuris",
            "url": "https://www.eemb.ucsb.edu/people/faculty/kuris"
          },
          {
            "name": "John Latto",
            "url": "https://www.eemb.ucsb.edu/people/faculty/latto"
          },
          {
            "name": "Sally MacIntyre",
            "url": "https://www.eemb.ucsb.edu/people/faculty/macintyre"
          },
          {
            "name": "Jesús Martínez-Gómez",
            "url": "https://www.eemb.ucsb.edu/people/faculty/martinez-gomez"
          },
          {
            "name": "Susan J. Mazer",
            "url": "https://www.eemb.ucsb.edu/people/faculty/mazer"
          },
          {
            "name": "Douglas McCauley",
            "url": "https://www.eemb.ucsb.edu/people/faculty/mccauley"
          },
          {
            "name": "Holly Moeller",
            "url": "https://www.eemb.ucsb.edu/people/faculty/moeller"
          },
          {
            "name": "Nick Nidzieko",
            "url": "https://www.eemb.ucsb.edu/people/faculty/nidzieko"
          },
          {
            "name": "Todd Oakley",
            "url": "https://www.eemb.ucsb.edu/people/faculty/oakley"
          },
          {
            "name": "Ryoko Oono",
            "url": "https://www.eemb.ucsb.edu/people/faculty/oono"
          },
          {
            "name": "Stephen Proulx",
            "url": "https://www.eemb.ucsb.edu/people/faculty/proulx"
          },
          {
            "name": "Joel Rothman",
            "url": "https://www.eemb.ucsb.edu/people/faculty/rothman"
          },
          {
            "name": "Alyson Santoro",
            "url": "https://www.eemb.ucsb.edu/people/faculty/santoro"
          },
          {
            "name": "Joshua Schimel",
            "url": "https://www.eemb.ucsb.edu/people/faculty/schimel"
          },
          {
            "name": "Joel Sharbrough",
            "url": "https://www.eemb.ucsb.edu/people/faculty/sharbrough"
          },
          {
            "name": "Jackie Shay",
            "url": "https://www.eemb.ucsb.edu/people/faculty/shay"
          },
          {
            "name": "Adrian Stier",
            "url": "https://www.eemb.ucsb.edu/people/faculty/stier"
          },
          {
            "name": "Samuel Sweet",
            "url": "https://www.eemb.ucsb.edu/people/faculty/sweet"
          },
          {
            "name": "Audrey Thellman",
            "url": "https://www.eemb.ucsb.edu/people/faculty/thellman"
          },
          {
            "name": "Andrew Thurber",
            "url": "https://www.eemb.ucsb.edu/people/faculty/thurber"
          },
          {
            "name": "Thomas Turner",
            "url": "https://www.eemb.ucsb.edu/people/faculty/turner"
          },
          {
            "name": "Rebecca Vega Thurber",
            "url": "https://www.eemb.ucsb.edu/people/faculty/vega-thurber"
          },
          {
            "name": "Lizzy Wilbanks",
            "url": "https://www.eemb.ucsb.edu/people/faculty/wilbanks"
          },
          {
            "name": "Soojin Yi",
            "url": "https://www.eemb.ucsb.edu/people/faculty/yi"
          },
          {
            "name": "Hillary Young",
            "url": "https://www.eemb.ucsb.edu/people/faculty/young"
          },
          {
            "name": "Yong Zhou",
            "url": "https://www.eemb.ucsb.edu/people/faculty/zhou"
          }
        ]
      }
    },
    {
      "name": "Researchers",
      "url": "https://www.eemb.ucsb.edu/people/researchers",
      "status": 200,
      "screenshot": "/Users/adrianstiermbp2023/eemb-website-redesign-2025-2026/docs/people-scrape-results/screenshots/researchers.png",
      "data": {
        "fullText": "Skip to main content\nMain navigation\nAbout\nPeople\nResearch\nAcademics \nNews\nEvents\nSupport \nGive\nPeople\nPrimary tabs\nFull Directory\nFaculty\nAdjunct\nEmeriti\nStaff\nResearch Scientists\n(active tab)\nStudents\nLeadership\nName\n \nFilter by\n- Any -\nAdrian Stier\nAlice Alldredge\nAlyson Santoro\nArmand Kuris\nCarla D'Antonio\nCherie Briggs\nCraig Carlson\nDavid Siegel\nDebora Iglesias-Rodriguez\nDeron Burkepile\nDouglas McCauley\nErika Eliason\nGretchen Hofmann\nHillary Young\nHolly Moeller\nJames Childress\nJoel Rothman\nJohn Latto\nJohn M. Melack\nJonathan Pruitt\nJosh Schimel\nLizzy Wilbanks\nMark Brzezinski\nPeter Collins\nRaul Suarez\nRobert Warner\nRoger Nisbet\nRussell Schmitt\nRyoko Oono\nSally Holbrook\nSally MacIntyre\nSamuel Sweet\nScott D. Cooper\nScott Hodges\nStephen Proulx\nSteve Gaines\nSteve Rothstein\nSusan J. Mazer\nThomas Even\nThomas Turner\nTodd Oakley\nWilliam Murdoch\nWilliam Rice\n Apply\nIvia Closset\nResearch Associate\n\n\nMarine Biogeochemistry, silicon isotopes, diatoms and silicon cycle.\nMark Brzezinski\nJohn Damuth\nResearch Biologist\n  \n4107 Life Sciences\nI am an ecologist, evolutionary biologist, and vertebrate paleontologist.\nChristopher Evelyn\nAssistant Researcher\n\n\nSamuel Sweet\nJames Gately\nPostdoc\n \n\nDebora Iglesias-Rodriguez\nFerdinand Pfab\nPostdoctoral Researcher\n\n2003 Noble Hall\nModeling biological systems: infections, evolution and population dynamics.\nCherie Briggs\nRoger Nisbet\nContact Us\n 805.893.2974\n info@eemb.ucsb.edu\n Jobs\n Visit EEMB\nSupport Services\n Administration\n Room Reservations\n Research Services\nTechnical Support\nShipping / Receiving\nWebsite\n Information\n Terms of Use\n Privacy\n Login\n  \n\nEcology, Evolution, and Marine Biology\nUniversity of California, Santa Barbara\n© 2025 Regents of the University of California",
        "headings": [
          {
            "level": "H2",
            "text": "Main navigation"
          },
          {
            "level": "H1",
            "text": "People"
          },
          {
            "level": "H2",
            "text": "Primary tabs"
          },
          {
            "level": "H3",
            "text": "Ivia Closset"
          },
          {
            "level": "H3",
            "text": "John Damuth"
          },
          {
            "level": "H3",
            "text": "Christopher Evelyn"
          },
          {
            "level": "H3",
            "text": "James Gately"
          },
          {
            "level": "H3",
            "text": "Ferdinand Pfab"
          },
          {
            "level": "H2",
            "text": "Contact Us"
          },
          {
            "level": "H2",
            "text": "Support Services"
          },
          {
            "level": "H2",
            "text": "Website"
          }
        ],
        "peopleLinks": [
          {
            "name": "Ivia Closset",
            "url": "https://www.eemb.ucsb.edu/people/researchers/closset"
          },
          {
            "name": "John Damuth",
            "url": "https://www.eemb.ucsb.edu/people/researchers/damuth"
          },
          {
            "name": "Christopher Evelyn",
            "url": "https://www.eemb.ucsb.edu/people/researchers/evelyn"
          },
          {
            "name": "James Gately",
            "url": "https://www.eemb.ucsb.edu/people/researchers/gately"
          },
          {
            "name": "Ferdinand Pfab",
            "url": "https://www.eemb.ucsb.edu/people/researchers/pfab"
          }
        ]
      }
    },
    {
      "name": "Graduate Students",
      "url": "https://www.eemb.ucsb.edu/people/graduate-students",
      "status": 404
    },
    {
      "name": "Staff",
      "url": "https://www.eemb.ucsb.edu/people/staff",
      "status": 200,
      "screenshot": "/Users/adrianstiermbp2023/eemb-website-redesign-2025-2026/docs/people-scrape-results/screenshots/staff.png",
      "data": {
        "fullText": "Skip to main content\nMain navigation\nAbout\nPeople\nResearch\nAcademics \nNews\nEvents\nSupport \nGive\nPeople\nPrimary tabs\nFull Directory\nFaculty\nAdjunct\nEmeriti\nStaff\n(active tab)\nResearch Scientists\nStudents\nLeadership\nName\n \nFilter by\n- Any -\nAcademic Advisor\nAdministration\nShipping / Receiving\nShops and Faciities\nTechnical Support\n Apply\nEvelin Ambrocio-Silva\nUndergraduate Academic Advisor\n \nLSB 3320\nPaul Diaz\nPurchasing Manager\n \nBio Receiving (Building 569) 1101\nManages the procurement operations and oversees purchasing, receiving, and equipment management.\nShipping / Receiving\nCatherine Drake\nAcademic Coordinator\n \n1118 BSIF\n\nAssists the MCDB and EEMB departments with running Intro Bio lecture and laboratory courses.\n\nSayward Halling\nIntro Bio Program Manager\n \n1118 Biological Sciences Instructional Facility\nWorks cross-departmentally with MCDB and EEMB to oversee the administration of lecture and laboratory Intro Bio courses.\nAdministration\nCameron Hannah-Bick\nGreenhouse Manager\n \n540 Greenhouse\nMaintains the school’s teaching collection and assists researchers with their experiments.\nShops and Faciities\nAndrea Jorgensen\nManagement Services Officer\n \n4306 Life Sciences Building\nResponsible for finance administration, payroll, non-academic personnel, recharges, & accounts payable.\nAdministration\nRoom Reservations\nRyan Langlo\nShop Superintendent\n \n1250A Bio Shop\nAssists with scientific equipment repair, research apparatus fabrication, and maintenance of departmental equipment.\nShops and Faciities\nSaru Lantier\nLab Coordinator\n\nBSIF 2219\nHaley Martin\nDirector of Finance\n \n4308 Life Sciences Building\nResponsible for finance administration, payroll, non-academic personnel, recharges, & accounts payable.\nAlice Nguyen\nAcademic Coordinator, Introductory Biology\n \n4326 Life Sciences Building\nOversees the Introductory Biology Program, including both lecture and lab courses. Co-director of the Ocean Global Change Biology REU program.\nMichael (Mickey) O'Connell\nMarine Mechanician\n \n1007 Marine Biotech\nResponsible for the daily upkeep of departmental boats, research equipment maintenance and repair, facilities management, and design and construction services.\nShops and Faciities\nChristian Orsini\nAssistant Diver / Collector\n \n102 Building 465\nResponsible for animal collections and care, facilities operations and maintenance, and captaining departmental boats.\nShops and Faciities\nOscar Perez\nLab Manager\n\n1118 Biological Sciences Instructional Facility\nManages the Introductory Biology Program laboratory courses.\nShops and Faciities\nDanielle Perez\nDepartmental Assistant\n \n4316 Life Sciences Building\nChristoph Pierre\nDirector of Marine Operations\n  \n102 Building 465\nResponsible for marine operations, seawater system function, boating program oversight and animal collections.\nShops and Faciities\nRosa Vasquez\nAcademic Personnel Analyst\n \nLSB 4310\nPatrick White\nShop Assistant\n\n1255 Bio Shop\nShops and Faciities\nEllery Wilkie\nUndergraduate Academic Advisor\n\n3318 Life Sciences Building\n\nAdvises undergraduates on the biology major(s), reviews petitions for graduation matters and creates the schedule of\n\nMengshu Ye\nStaff Graduate Advisor\n \n4310 Life Sciences Building\n\nServes as Graduate Advisor for EEMB/IGPMS.\n\nDepartment Administration\n\nAcademic Business Officer\nAndrea Jorgensen\namjorgen@ucsb.edu\n\nAcademic Personnel\nRosa Vasquez\nrosavasquez@ucsb.edu\n\nDepartmental Assistant\nDanielle Perez\ndcperez@ucsb.edu\n\nDirector of Finance\nHaley Martin\nhaleymartin@ucsb.edu\n\nStaff Graduate Advisor\nMengshu Ye\nmengshuye@ucsb.edu\n\nUndergraduate Advisor\nEllery Wilkie\newilkie@lifesci.ucsb.edu\n\nConference Rooms\n4164 Bio 2 (Clarke Carbon)\n4301 Life Sciences\n4307 Life Sciences\n3103 Marine Biotechnology\n1231 Noble Hall\n2221 Noble Hall\nMailing Address\n\nEcology, Evolution, and Marine Biology\nUniversity of California, Santa Barbara\nSanta Barbara, CA 93106-9620\n\nContact Us\n 805.893.2974\n info@eemb.ucsb.edu\n Jobs\n Visit EEMB\nSupport Services\n Administration\n Room Reservations\n Research Services\nTechnical Support\nShipping / Receiving\nWebsite\n Information\n Terms of Use\n Privacy\n Login\n  \n\nEcology, Evolution, and Marine Biology\nUniversity of California, Santa Barbara\n© 2025 Regents of the University of California",
        "headings": [
          {
            "level": "H2",
            "text": "Main navigation"
          },
          {
            "level": "H1",
            "text": "People"
          },
          {
            "level": "H2",
            "text": "Primary tabs"
          },
          {
            "level": "H3",
            "text": "Evelin Ambrocio-Silva"
          },
          {
            "level": "H3",
            "text": "Paul Diaz"
          },
          {
            "level": "H3",
            "text": "Catherine Drake"
          },
          {
            "level": "H3",
            "text": "Sayward Halling"
          },
          {
            "level": "H3",
            "text": "Cameron Hannah-Bick"
          },
          {
            "level": "H3",
            "text": "Andrea Jorgensen"
          },
          {
            "level": "H3",
            "text": "Ryan Langlo"
          },
          {
            "level": "H3",
            "text": "Saru Lantier"
          },
          {
            "level": "H3",
            "text": "Haley Martin"
          },
          {
            "level": "H3",
            "text": "Alice Nguyen"
          },
          {
            "level": "H3",
            "text": "Michael (Mickey) O'Connell"
          },
          {
            "level": "H3",
            "text": "Christian Orsini"
          },
          {
            "level": "H3",
            "text": "Oscar Perez"
          },
          {
            "level": "H3",
            "text": "Danielle Perez"
          },
          {
            "level": "H3",
            "text": "Christoph Pierre"
          },
          {
            "level": "H3",
            "text": "Rosa Vasquez"
          },
          {
            "level": "H3",
            "text": "Patrick White"
          },
          {
            "level": "H3",
            "text": "Ellery Wilkie"
          },
          {
            "level": "H3",
            "text": "Mengshu Ye"
          },
          {
            "level": "H2",
            "text": "Department Administration"
          },
          {
            "level": "H2",
            "text": "Conference Rooms"
          },
          {
            "level": "H2",
            "text": "Mailing Address"
          },
          {
            "level": "H2",
            "text": "Contact Us"
          },
          {
            "level": "H2",
            "text": "Support Services"
          },
          {
            "level": "H2",
            "text": "Website"
          }
        ],
        "peopleLinks": [
          {
            "name": "Evelin Ambrocio-Silva",
            "url": "https://www.eemb.ucsb.edu/people/staff/ambrocio-silva"
          },
          {
            "name": "Paul Diaz",
            "url": "https://www.eemb.ucsb.edu/people/staff/diaz"
          },
          {
            "name": "Catherine Drake",
            "url": "https://www.eemb.ucsb.edu/people/staff/drake"
          },
          {
            "name": "Sayward Halling",
            "url": "https://www.eemb.ucsb.edu/people/staff/halling"
          },
          {
            "name": "Cameron Hannah-Bick",
            "url": "https://www.eemb.ucsb.edu/people/staff/hannah-bick"
          },
          {
            "name": "Andrea Jorgensen",
            "url": "https://www.eemb.ucsb.edu/people/staff/jorgensen"
          },
          {
            "name": "Ryan Langlo",
            "url": "https://www.eemb.ucsb.edu/people/staff/langlo"
          },
          {
            "name": "Saru Lantier",
            "url": "https://www.eemb.ucsb.edu/people/staff/lantier"
          },
          {
            "name": "Haley Martin",
            "url": "https://www.eemb.ucsb.edu/people/staff/martin"
          },
          {
            "name": "Alice Nguyen",
            "url": "https://www.eemb.ucsb.edu/people/staff/nguyen"
          },
          {
            "name": "Michael (Mickey) O'Connell",
            "url": "https://www.eemb.ucsb.edu/people/staff/oconnell"
          },
          {
            "name": "Christian Orsini",
            "url": "https://www.eemb.ucsb.edu/people/staff/orsini"
          },
          {
            "name": "Oscar Perez",
            "url": "https://www.eemb.ucsb.edu/people/staff/perez"
          },
          {
            "name": "Danielle Perez",
            "url": "https://www.eemb.ucsb.edu/people/staff/dcperez"
          },
          {
            "name": "Christoph Pierre",
            "url": "https://www.eemb.ucsb.edu/people/staff/pierre"
          },
          {
            "name": "Rosa Vasquez",
            "url": "https://www.eemb.ucsb.edu/people/staff/vasquez"
          },
          {
            "name": "Patrick White",
            "url": "https://www.eemb.ucsb.edu/people/staff/white"
          },
          {
            "name": "Ellery Wilkie",
            "url": "https://www.eemb.ucsb.edu/people/staff/wilkie"
          },
          {
            "name": "Mengshu Ye",
            "url": "https://www.eemb.ucsb.edu/people/staff/ye"
          }
        ]
      }
    }
  ],
  "people": [
    {
      "name": "Evelin Ambrocio-Silva",
      "url": "https://www.eemb.ucsb.edu/people/staff/ambrocio-silva",
      "status": 200,
      "data": {
        "email": "eambrocio@lifesci.ucsb.edu",
        "phone": "805-893-4622",
        "title": "Main navigation",
        "office": "Office:\n \nLSB 3320",
        "interests": null,
        "bio": "",
        "website": "https://undergrad.biology.ucsb.edu/",
        "fullText": "Skip to main content\nMain navigation\nAbout\nPeople\nResearch\nAcademics \nNews\nEvents\nSupport \nGive\nPeople  Staff\nEvelin Ambrocio-Silva\nUndergraduate Academic Advisor\nPhone:\n \n805-893-4622\nEmail:\n \neambrocio@lifesci.ucsb.edu\nOffice:\n \nLSB 3320\nContact Us\n 805.893.2974\n info@eemb.ucsb.edu\n Jobs\n Visit EEMB\nSupport Services\n Administration\n Room Reservations\n Research Services\nTechnical Support\nShipping / Receiving\nWebsite\n Information\n Terms of Use\n Privacy\n Login\n  \n\nEcology, Evolution, and Marine Biology\nUniversity of California, Santa Barbara\n© 2025 Regents of the University of California"
      }
    },
    {
      "name": "Leander Anderegg",
      "url": "https://www.eemb.ucsb.edu/people/faculty/anderegg",
      "status": 200,
      "data": {
        "email": "landeregg@ucsb.edu",
        "phone": "805.893.2974",
        "title": "Main navigation",
        "office": null,
        "interests": null,
        "bio": "",
        "website": "https://undergrad.biology.ucsb.edu/",
        "fullText": "Skip to main content\nMain navigation\nAbout\nPeople\nResearch\nAcademics \nNews\nEvents\nSupport \nGive\nPeople  Faculty\nLeander Anderegg\nAssistant Professor\nEmail:\n \nlanderegg@ucsb.edu\nWebsite:\n \nAnderegg Landscape Physiology Lab\nTwitter Link:\n \n@leanderegg\nPublications Link:\n \nGoogle Scholar\nAreas of Research\nBotany\nEcological and Evolutionary Physiology\nEcology\nEcosystem Ecology\nOrganismal Biology\nPopulation and Community Ecology\nBiography\n\nI grew up in rural Colorado, and have spent much of my life trying to justify spending time in the woods. I received a BA in Human Biology from Stanford University in 2011, and got hooked on research while performing honors research on the water use of trembling aspen trees. I went on to study plant ecology with Janneke Hille Ris Lambers at the University of Washington. I received a PhD in Biology from the UW in 2017, with my dissertation focusing on within-species physiological variation and species geographic range constraints. Before joinging EEMB at UCSB, I spent two years as an NSF Biological Collections postdoctoral fellow and two years as a NOAA Climate and Global Change fellow working jointly with Todd Dawson (UC Berkeley) and Joe Berry (Carnegie Institution for Science) studying plant responses to global change through a lens of drought physiology and remote sensing.\n\nResearch\n\nMy research seeks to scale up the physiological responses of plants to biotic and abiotic stress to explain population level, community level and biogeographic processes. I seek to understand how plants respond physiologically to climatic, biotic, and anthropogenic stresses in order to forecast future ecosystem structure and function. My work asks: How do plants cope with stress? What biophysical and evolutionary constraints define plant stress response strategies? How will multiple stresses affect species geographic ranges, community structure, and ecosystem function? I blend plant physiology and ecology to explain community and ecosystem processes ran"
      }
    },
    {
      "name": "Cherie Briggs",
      "url": "https://www.eemb.ucsb.edu/people/faculty/briggs",
      "status": 200,
      "data": {
        "email": "briggs@lifesci.ucsb.edu",
        "phone": "805.893.2199",
        "title": "Main navigation",
        "office": "Office:\n \n2112 Noble Hall",
        "interests": null,
        "bio": "",
        "website": "https://undergrad.biology.ucsb.edu/",
        "fullText": "Skip to main content\nMain navigation\nAbout\nPeople\nResearch\nAcademics \nNews\nEvents\nSupport \nGive\nPeople  Faculty\nCherie Briggs\nProfessor\nPhone:\n \n805.893.2199\nEmail:\n \nbriggs@lifesci.ucsb.edu\nOffice:\n \n2112 Noble Hall\nWebsite:\n \nBriggs Lab\nPublications Link:\n \nGoogle Scholar\nAreas of Research\nDisease Ecology\nEcology\nPopulation and Community Ecology\nBiography\n\nDr. Briggs received B.S. degrees in Electrical Engineering and Biological Sciences from Michigan Technological University. She received an M.S. in Electrical Engineering at Princeton University, while working at Bell Labs. She received a PhD in Biology from UCSB, where she studied host-parasitoid population dynamics. As a postdoctoral researcher at Imperial College, Silwood Park in England, she developed models of insect-pathogen interactions. Dr. Briggs was on the faculty in the Dept. of Integrative Biology at UC Berkeley from 1997-2007, and then joined the UCSB faculty in 2007. She holds a joint appointment EEMB and BMSE, and is a Mellichamp Chair in Systems Biology.\n\nResearch\n\nDr. Briggs’ research combines modeling and experiments to understand the factors affecting the dynamics of animal populations. Her lab is working on a number of projects involving disease-host or parasitoid-host interactions, including:\n\nThe Frog-killing Chytrid Fungus in the California Sierra Nevada\n\nThe Briggs lab is investigating the factors that allow for persistence of populations of mountain yellow-legged frogs infected with the chytrid fungus, Batrachochytrium dendrobatidis, through a combination of field surveys, experiments, genetics, molecular techniques, and modeling.\n\nLyme Disease in Southern California\n\nLyme disease, caused by bacteria, Borrelia burgdorferi, is maintained in the wild in vertebrate hosts, and transmitted between hosts by ticks. Lyme disease has a much higher prevalence in the eastern US than in California. The Briggs lab is studying the dynamics of the tick, pathogen, and vertebrate host communities in South"
      }
    },
    {
      "name": "Deron Burkepile",
      "url": "https://www.eemb.ucsb.edu/people/faculty/burkepile",
      "status": 200,
      "data": {
        "email": "deron.burkepile@lifesci.ucsb.edu",
        "phone": "805.893.3067",
        "title": "Main navigation",
        "office": "Office:\n \n4312 Marine Science Institute",
        "interests": null,
        "bio": "",
        "website": "https://undergrad.biology.ucsb.edu/",
        "fullText": "Skip to main content\nMain navigation\nAbout\nPeople\nResearch\nAcademics \nNews\nEvents\nSupport \nGive\nPeople  Faculty\nDeron Burkepile\nProfessor\nPhone:\n \n805.893.3067\nEmail:\n \nderon.burkepile@lifesci.ucsb.edu\nOffice:\n \n4312 Marine Science Institute\nWebsite:\n \nBurkepile Community Ecology Laboratory\nPublications Link:\n \nGoogle Scholar\nAreas of Research\nBehavior\nEcosystem Ecology\nMarine Biology\nPopulation and Community Ecology\nZoology\nBiography\n\nI received my B.A. in Biology from the University of Mississippi in 1999 where I studied marine natural products chemistry and chemical ecology. In 2006, I received my Ph.D. from Georgia Tech under the direction of Mark Hay with a dissertation focused on the interactive roles of herbivores and productivity in structuring coral reef communities. After my Ph.D., I spent two years as the Brown Post-doctoral Fellow in Melinda Smith's lab at Yale University where I worked on the interactions of herbivory, fire, and productivity in driving the ecology of African savannas. I was an Assistant Professor at Florida International University 2008-2015 before moving to UC Santa Barbara.\n\nResearch\n\nThe Burkepile Lab focuses on questions that provide fundamental understanding about the ecology of communities and ecosystems while also informing the conservation and restoration of these systems. Four themes define our lab’s current work: (1) how exploitation of consumers and loss of consumer biodiversity impacts ecosystem function, (2) how predation risk affects herbivore distribution and their impact on plant communities, (3) how anthropogenic and consumer-derived nutrients impacts community dynamics and disease, and (4) how global change alters consumer-prey interactions. Many of these themes span both marine and terrestrial ecosystems, although coral reefs are our main focus. Our most productive research occurs when these themes interact to address how multiple anthropogenic forces impact community dynamics and ecosystem function.\n\nContact Us\n 805."
      }
    },
    {
      "name": "Ivia Closset",
      "url": "https://www.eemb.ucsb.edu/people/researchers/closset",
      "status": 200,
      "data": {
        "email": "ivia@ucsb.edu",
        "phone": "805.893.2974",
        "title": "Main navigation",
        "office": null,
        "interests": null,
        "bio": "",
        "website": "https://undergrad.biology.ucsb.edu/",
        "fullText": "Skip to main content\nMain navigation\nAbout\nPeople\nResearch\nAcademics \nNews\nEvents\nSupport \nGive\nPeople  Researchers\nIvia Closset\nResearch Associate\nEmail:\n \nivia@ucsb.edu\nAdvisor\nMark Brzezinski\n\nMarine Biogeochemistry, silicon isotopes, diatoms and silicon cycle.\n\nContact Us\n 805.893.2974\n info@eemb.ucsb.edu\n Jobs\n Visit EEMB\nSupport Services\n Administration\n Room Reservations\n Research Services\nTechnical Support\nShipping / Receiving\nWebsite\n Information\n Terms of Use\n Privacy\n Login\n  \n\nEcology, Evolution, and Marine Biology\nUniversity of California, Santa Barbara\n© 2025 Regents of the University of California"
      }
    },
    {
      "name": "Carla D'Antonio",
      "url": "https://www.eemb.ucsb.edu/people/faculty/dantonio",
      "status": 200,
      "data": {
        "email": "dantonio@es.ucsb.edu",
        "phone": "805.893.2796",
        "title": "Main navigation",
        "office": "Office:\n \n4002 Bren Hall",
        "interests": null,
        "bio": "",
        "website": "https://undergrad.biology.ucsb.edu/",
        "fullText": "Skip to main content\nMain navigation\nAbout\nPeople\nResearch\nAcademics \nNews\nEvents\nSupport \nGive\nPeople  Faculty\nCarla D'Antonio\nProfessor\nPhone:\n \n805.893.2796\nEmail:\n \ndantonio@es.ucsb.edu\nOffice:\n \n4002 Bren Hall\nWebsite:\n \nD'Antonio Lab\nPublications Link:\n \nGoogle Scholar\nAreas of Research\nBotany\nEcology\nEcosystem Ecology\nPopulation and Community Ecology\nBiography\n\nI obtained a MS degree in marine ecology before opting for dry land for my PhD. This I obtained at UCSB, studying context dependent invasion of coastal plant communities by a South African plant. Simultaneously, I worked as a botanist for Channel Islands National Park helping to initiate their ecosystem restoration program. I then postdoc’d at Stanford where I launched what became an 8 year study of invasion and ecosystem change in Hawaii Volcanoes National Park. After 13 years on the faculty in the Department of Integrative Biology at UC Berkeley, and three years with the USDA-ARS Exotic and Invasive Weeds Program in Reno, I moved to UCSB where I hold a joint position with Environmental Studies and EEMB.\n\nResearch\n\nMy research lies at the interface of plant community and ecosystem ecology. The goals of my research program are, to understand controls over variation in plant community change across landscapes and how the invasion of species affects ecosystem composition, structure and functioning. Specific foci include processes that control invasions by non-indigenous plant species and mechanisms through which plants affect ecosystem functioning over short versus long time scales. While I have not limited the lab’s research to introduced species, studying them aids in the search for generality in ecology while providing context specific information regarding invasion, and the potential for long term soil or vegetation change to land managers and restoration practitioners. In the past five years my research contributions have largely been in the following areas: (1) Species traits, invasion success and "
      }
    },
    {
      "name": "John Damuth",
      "url": "https://www.eemb.ucsb.edu/people/researchers/damuth",
      "status": 200,
      "data": {
        "email": "damuth@lifesci.ucsb.edu",
        "phone": "805.729.4393",
        "title": "Main navigation",
        "office": "Office:\n \n4107 Life Sciences",
        "interests": null,
        "bio": "",
        "website": "https://undergrad.biology.ucsb.edu/",
        "fullText": "Skip to main content\nMain navigation\nAbout\nPeople\nResearch\nAcademics \nNews\nEvents\nSupport \nGive\nPeople  Researchers\nJohn Damuth\nResearch Biologist\nPhone:\n \n805.729.4393\nEmail:\n \ndamuth@lifesci.ucsb.edu\nOffice:\n \n4107 Life Sciences\nWebsite:\n \nJohn Damuth Research Website\nGoogle Scholar\nBiography\n1974; B.A. Anthropology; Yale University, New Haven Connecticut\n1976; S.M. Evolutionary Biology; University of Chicago, Chicago, Illinois\n1982; Ph.D Evolutionary Biology; University of Chicago, Chicago, Illinois\n\nCurrent Appointment: Research Biologist (research faculty appointment at full Professor level), Department of Ecology, Evolution, and Marine Biology, University of California, Santa Barbara\n\nResearch\n\nI am an ecologist, evolutionary biologist, and vertebrate paleontologist. My research investigates the ways in which our knowledge of the ecology and evolutionary biology of extant organisms can be applied to understand long-term and large-scale evolution, primarily of terrestrial vertebrates. It is a synthetic research program that integrates a variety of areas of neontology and the Cenozoic record of fossil mammals, as well as the conceptual basis for explaining long-term evolutionary processes. My research has contributed to our understanding of the size-scaling of organismal abundance and population energy-use, the analysis of multilevel selection, the interplay between global climate change and the structure of mammal faunas worldwide during the Cenozoic, the paleobiology of extinct herbivores, and the nature of general processes that can underlie ecological and evolutionary “laws” observable on large scales.\n\nAreas of Research\nAllometry and scaling, ecological correlates of body size\nEvolutionary theory — particularly, mechanisms of long-term evolutionary change and of multilevel selection; non-adaptive selection processes\nEcological aspects of “macroevolution” and evolutionary aspects of “macroecology”\nStructure and evolution of mammal communities; analysis and r"
      }
    },
    {
      "name": "Paul Diaz",
      "url": "https://www.eemb.ucsb.edu/people/staff/diaz",
      "status": 200,
      "data": {
        "email": "pdiaz@lifesci.ucsb.edu",
        "phone": "(805) 893-3234",
        "title": "Main navigation",
        "office": "Office:\n \nBio Receiving (Building 569) 1101",
        "interests": null,
        "bio": "",
        "website": "https://undergrad.biology.ucsb.edu/",
        "fullText": "Skip to main content\nMain navigation\nAbout\nPeople\nResearch\nAcademics \nNews\nEvents\nSupport \nGive\nPeople  Staff\nPaul Diaz\nPurchasing Manager\nPhone:\n \n(805) 893-3234\nEmail:\n \npdiaz@lifesci.ucsb.edu\nOffice:\n \nBio Receiving (Building 569) 1101\nJob Duties\n\nResponsibilities Responsible for approval process of purchasing supplies and equipment, ensures contracts are in place, and reviews vendor blankets. Ensures the appropriate standard operating procedure for receiving. Oversees equipment management, Gateway inquiries, and sole source selection.\n\nRelated Pages\nShipping and Receiving\nContact Us\n 805.893.2974\n info@eemb.ucsb.edu\n Jobs\n Visit EEMB\nSupport Services\n Administration\n Room Reservations\n Research Services\nTechnical Support\nShipping / Receiving\nWebsite\n Information\n Terms of Use\n Privacy\n Login\n  \n\nEcology, Evolution, and Marine Biology\nUniversity of California, Santa Barbara\n© 2025 Regents of the University of California"
      }
    },
    {
      "name": "Catherine Drake",
      "url": "https://www.eemb.ucsb.edu/people/staff/drake",
      "status": 200,
      "data": {
        "email": "cdrake@ucsb.edu",
        "phone": "805.893.3357",
        "title": "Main navigation",
        "office": "Office:\n \n1118 BSIF",
        "interests": null,
        "bio": "",
        "website": "https://undergrad.biology.ucsb.edu/",
        "fullText": "Skip to main content\nMain navigation\nAbout\nPeople\nResearch\nAcademics \nNews\nEvents\nSupport \nGive\nPeople  Staff\nCatherine Drake\nAcademic Coordinator\nPhone:\n \n805.893.3357\nEmail:\n \ncdrake@ucsb.edu\nOffice:\n \n1118 BSIF\nJob Duties\n\nAssists the MCDB and EEMB departments with running Intro Bio lecture and laboratory courses.\n\nContact Us\n 805.893.2974\n info@eemb.ucsb.edu\n Jobs\n Visit EEMB\nSupport Services\n Administration\n Room Reservations\n Research Services\nTechnical Support\nShipping / Receiving\nWebsite\n Information\n Terms of Use\n Privacy\n Login\n  \n\nEcology, Evolution, and Marine Biology\nUniversity of California, Santa Barbara\n© 2025 Regents of the University of California"
      }
    },
    {
      "name": "Christopher Evelyn",
      "url": "https://www.eemb.ucsb.edu/people/researchers/evelyn",
      "status": 200,
      "data": {
        "email": "christopher.evelyn@lifesci.ucsb.edu",
        "phone": "805.893.2974",
        "title": "Main navigation",
        "office": null,
        "interests": null,
        "bio": "",
        "website": "https://undergrad.biology.ucsb.edu/",
        "fullText": "Skip to main content\nMain navigation\nAbout\nPeople\nResearch\nAcademics \nNews\nEvents\nSupport \nGive\nPeople  Researchers\nChristopher Evelyn\nAssistant Researcher\nEmail:\n \nchristopher.evelyn@lifesci.ucsb.edu\nAdvisor\nSamuel Sweet\nContact Us\n 805.893.2974\n info@eemb.ucsb.edu\n Jobs\n Visit EEMB\nSupport Services\n Administration\n Room Reservations\n Research Services\nTechnical Support\nShipping / Receiving\nWebsite\n Information\n Terms of Use\n Privacy\n Login\n  \n\nEcology, Evolution, and Marine Biology\nUniversity of California, Santa Barbara\n© 2025 Regents of the University of California"
      }
    },
    {
      "name": "Thomas Even",
      "url": "https://www.eemb.ucsb.edu/people/faculty/even",
      "status": 200,
      "data": {
        "email": "even@lifesci.ucsb.edu",
        "phone": "805.893.2904",
        "title": "Main navigation",
        "office": "Office:\n \n4322 Life Sciences Building",
        "interests": null,
        "bio": "",
        "website": "https://undergrad.biology.ucsb.edu/",
        "fullText": "Skip to main content\nMain navigation\nAbout\nPeople\nResearch\nAcademics \nNews\nEvents\nSupport \nGive\nPeople  Faculty\nThomas Even\nSenior Lecturer\nProfessor\nPhone:\n \n805.893.2904\nEmail:\n \neven@lifesci.ucsb.edu\nOffice:\n \n4322 Life Sciences Building\nAreas of Research\nAquatic Biology\nEcology\nLimnology\nOrganismal Biology\nPopulation and Community Ecology\nResearch\n\nPopulation and community ecology, river ecology, predator-prey interactions, science education.\n\nContact Us\n 805.893.2974\n info@eemb.ucsb.edu\n Jobs\n Visit EEMB\nSupport Services\n Administration\n Room Reservations\n Research Services\nTechnical Support\nShipping / Receiving\nWebsite\n Information\n Terms of Use\n Privacy\n Login\n  \n\nEcology, Evolution, and Marine Biology\nUniversity of California, Santa Barbara\n© 2025 Regents of the University of California"
      }
    },
    {
      "name": "Halley Froehlich",
      "url": "https://www.eemb.ucsb.edu/people/faculty/froehlich",
      "status": 200,
      "data": {
        "email": "hefroehlich@ucsb.edu",
        "phone": "805.893.7016",
        "title": "Main navigation",
        "office": "Office:\n \n4007 Bren Hall",
        "interests": null,
        "bio": "",
        "website": "https://undergrad.biology.ucsb.edu/",
        "fullText": "Skip to main content\nMain navigation\nAbout\nPeople\nResearch\nAcademics \nNews\nEvents\nSupport \nGive\nPeople  Faculty\nHalley Froehlich\nAssistant Professor\nPhone:\n \n805.893.7016\nEmail:\n \nhefroehlich@ucsb.edu\nOffice:\n \n4007 Bren Hall\nWebsite:\n \nFroehlich Lab\nTwitter Link:\n \n@DocFroehlich\nPublications Link:\n \nGoogle Scholar\nAreas of Research\nMarine Biology\nBehavior\nEcological and Evolutionary Physiology\nEcology\nPopulation and Community Ecology\nBiography\n\nDr. Froehlich earned her B.Sc. in Animal Biology from the University of California, Davis and her Ph.D. in Marine Ecology & Fishery Sciences from the University of Washington, where she took an interdisciplinary approach studying the impacts of anthropogenic stressors, such as hypoxia, on exploited marine ecosystems and species. As a Postdoctoral Scholar at the National Center for Ecological Analysis and Synthesis, she studied the potential of sustainable open-ocean aquaculture. Dr. Froehlich started her Interdepartmental Graduate Program in Marine Science (IGPMS) appointment in 2019, joining the departments of Ecology, Evolution, & Marine Biology and Environmental Studies. She is currently a co-PI on several cross-departmental seafood and aquaculture projects.\n\nResearch\n\nSustainability of seafood and marine ecosystems are increasingly threatened by multiple stressors that act and interact at different scales. Globally, aquaculture (i.e., aquatic farming) is now a dominant form of seafood production, but there are major scientific gaps in understanding the consequences of aquatic farming in a larger, ecological food-system context, especially under a changing climate. In the Froehlich Lab, our research aims to tackle these problems by understanding the links between patterns and process at the species to global scale, using field- and lab-based physiology and behavior analyses, combined with social and ecological modelling and data science. Currently, my lab is exploring interactions and impacts of aquaculture, wild fisherie"
      }
    },
    {
      "name": "James Gately",
      "url": "https://www.eemb.ucsb.edu/people/researchers/gately",
      "status": 200,
      "data": {
        "email": "james.gately@lifesci.ucsb.edu",
        "phone": "805.893.xxxxx",
        "title": "Main navigation",
        "office": null,
        "interests": null,
        "bio": "",
        "website": "https://undergrad.biology.ucsb.edu/",
        "fullText": "Skip to main content\nMain navigation\nAbout\nPeople\nResearch\nAcademics \nNews\nEvents\nSupport \nGive\nPeople  Researchers\nJames Gately\nPostdoc\nPhone:\n \n805.893.xxxxx\nEmail:\n \njames.gately@lifesci.ucsb.edu\nAdvisor\nDebora Iglesias-Rodriguez\nContact Us\n 805.893.2974\n info@eemb.ucsb.edu\n Jobs\n Visit EEMB\nSupport Services\n Administration\n Room Reservations\n Research Services\nTechnical Support\nShipping / Receiving\nWebsite\n Information\n Terms of Use\n Privacy\n Login\n  \n\nEcology, Evolution, and Marine Biology\nUniversity of California, Santa Barbara\n© 2025 Regents of the University of California"
      }
    },
    {
      "name": "Sayward Halling",
      "url": "https://www.eemb.ucsb.edu/people/staff/halling",
      "status": 200,
      "data": {
        "email": "sayward.halling@lifesci.ucsb.edu",
        "phone": "805.893.3357",
        "title": "Main navigation",
        "office": "Office:\n \n1118 Biological Sciences Instructional Facility",
        "interests": null,
        "bio": "",
        "website": "https://undergrad.biology.ucsb.edu/",
        "fullText": "Skip to main content\nMain navigation\nAbout\nPeople\nResearch\nAcademics \nNews\nEvents\nSupport \nGive\nPeople  Staff\nSayward Halling\nIntro Bio Program Manager\nPhone:\n \n805.893.3357\nEmail:\n \nsayward.halling@lifesci.ucsb.edu\nOffice:\n \n1118 Biological Sciences Instructional Facility\nJob Duties\n\nWorks cross-departmentally with MCDB and EEMB to oversee the administration of lecture and laboratory Intro Bio courses.\n\nContact Us\n 805.893.2974\n info@eemb.ucsb.edu\n Jobs\n Visit EEMB\nSupport Services\n Administration\n Room Reservations\n Research Services\nTechnical Support\nShipping / Receiving\nWebsite\n Information\n Terms of Use\n Privacy\n Login\n  \n\nEcology, Evolution, and Marine Biology\nUniversity of California, Santa Barbara\n© 2025 Regents of the University of California"
      }
    },
    {
      "name": "Cameron Hannah-Bick",
      "url": "https://www.eemb.ucsb.edu/people/staff/hannah-bick",
      "status": 200,
      "data": {
        "email": "cameron.hannah-bick@lifesci.ucsb.edu",
        "phone": "805.893.2867",
        "title": "Main navigation",
        "office": "Office:\n \n540 Greenhouse",
        "interests": null,
        "bio": "",
        "website": "https://undergrad.biology.ucsb.edu/",
        "fullText": "Skip to main content\nMain navigation\nAbout\nPeople\nResearch\nAcademics \nNews\nEvents\nSupport \nGive\nPeople  Staff\nCameron Hannah-Bick\nGreenhouse Manager\nPhone:\n \n805.893.2867\nEmail:\n \ncameron.hannah-bick@lifesci.ucsb.edu\nOffice:\n \n540 Greenhouse\nJob Duties\n\nMaintains the school’s teaching collection and assists researchers with their experiments.\n\nRelated Pages\nBiology Greenhouse Facility\nResearch Services\nContact Us\n 805.893.2974\n info@eemb.ucsb.edu\n Jobs\n Visit EEMB\nSupport Services\n Administration\n Room Reservations\n Research Services\nTechnical Support\nShipping / Receiving\nWebsite\n Information\n Terms of Use\n Privacy\n Login\n  \n\nEcology, Evolution, and Marine Biology\nUniversity of California, Santa Barbara\n© 2025 Regents of the University of California"
      }
    },
    {
      "name": "Scott Hodges",
      "url": "https://www.eemb.ucsb.edu/people/faculty/hodges",
      "status": 200,
      "data": {
        "email": "hodges@lifesci.ucsb.edu",
        "phone": "805.893.7813",
        "title": "Main navigation",
        "office": "Office:\n \n4105 Life Sciences Building",
        "interests": null,
        "bio": "",
        "website": "https://undergrad.biology.ucsb.edu/",
        "fullText": "Skip to main content\nMain navigation\nAbout\nPeople\nResearch\nAcademics \nNews\nEvents\nSupport \nGive\nPeople  Faculty\nScott Hodges\nProfessor\nPhone:\n \n805.893.7813\nEmail:\n \nhodges@lifesci.ucsb.edu\nOffice:\n \n4105 Life Sciences Building\nPublications Link:\n \nGoogle Scholar\nAreas of Research\nBotany\nEcology\nEvolution\nEvolutionary Ecology\nEvolutionary Genetics\nMacroevolution\nOrganismal Biology\nBiography\n\nScott Hodges received his undergraduate degrees in Botany and Biology at the University of California, Berkeley where he also received his Ph.D. in Botany in Herbert Baker’s laboratory. He then taught Ecology at Barnard College in Manhattan, followed by a postdoctoral position at the University of Georgia in Mike Arnold’s laboratory, where he began his studies on Aquilegia. He then began his current position on the faculty in EEMB.\n\nResearch\n\nThe goal of our research is to elucidate the genetic basis of adaptation and speciation. We have focused our efforts primarily on floral diversity in Aquilegia because of the huge variation in floral form among species with adaptations to bee, hummingbird and hawkmoth pollination. In particular, we have shown that the length, shape and color of nectar spurs affect which, and how, animals act as pollinators, which influence reproductive isolation. We have linked these studies with macroevolutionary patterns showing that the evolution of spurs is correlated with speciation and species diversification.\n\nWe are now working to identify the specific genetic variation accounting for floral and ecological variation in Aquilegia. To that end, I have led the development of genomic resources for the genus with colleagues Elena Kramer (Harvard U.), Magnus Nordborg (Gregor Mendel Inst., Vienna) and Justin Borevitz (Australian National University). Particularly exciting has been the development of a high quality reference genome by the Joint Genome Institute.\n\nContact Us\n 805.893.2974\n info@eemb.ucsb.edu\n Jobs\n Visit EEMB\nSupport Services\n Administration"
      }
    },
    {
      "name": "Gretchen Hofmann",
      "url": "https://www.eemb.ucsb.edu/people/faculty/hofmann",
      "status": 200,
      "data": {
        "email": "hofmann@ucsb.edu",
        "phone": "805.893.6175",
        "title": "Main navigation",
        "office": "Office:\n \n4310 Marine Science Institute",
        "interests": null,
        "bio": "",
        "website": "https://undergrad.biology.ucsb.edu/",
        "fullText": "Skip to main content\nMain navigation\nAbout\nPeople\nResearch\nAcademics \nNews\nEvents\nSupport \nGive\nPeople  Faculty\nGretchen Hofmann\nProfessor\nPhone:\n \n805.893.6175\nEmail:\n \nhofmann@ucsb.edu\nOffice:\n \n4310 Marine Science Institute\nWebsite:\n \nHofmann Lab\nPublications Link:\n \nGoogle Scholar\nAreas of Research\nEcological and Evolutionary Physiology\nMarine Biology\nOrganismal Biology\nResearch\n\nWork in the Hofmann Lab group focuses on the ecological physiology of marine organisms, in particular kelp, invertebrates and perciform fishes. Although the research projects in the lab are quite diverse, we are collectively interested in understanding the role of temperature and oceanographic features in setting species' distribution patterns in the marine environment.\n\nCurrently, there are five main research projects in the Hofmann Lab\n\nMacrophysology in the marine environment: Are species more physiologically stressed at the extremes of their biogeographic range?\nEnvironmental genomics: Using DNA microarrays to map patterns of gene expression onto species range in the marine environment\nGene expression profiling & cold adaptation: Comparisons of gene expression in Antarctic and New Zealand notothenioid fishes\nLarval physiology: Examining thermotolerance of marine invertebrate larvae from a biogeographical perspective\nTemperature stress physiology of corals (http://mcr.lternet.edu/)\nContact Us\n 805.893.2974\n info@eemb.ucsb.edu\n Jobs\n Visit EEMB\nSupport Services\n Administration\n Room Reservations\n Research Services\nTechnical Support\nShipping / Receiving\nWebsite\n Information\n Terms of Use\n Privacy\n Login\n  \n\nEcology, Evolution, and Marine Biology\nUniversity of California, Santa Barbara\n© 2025 Regents of the University of California"
      }
    },
    {
      "name": "Débora Iglesias-Rodriguez",
      "url": "https://www.eemb.ucsb.edu/people/faculty/iglesias-rodriguez",
      "status": 200,
      "data": {
        "email": "iglesias@lifesci.ucsb.edu",
        "phone": "805.893.4680",
        "title": "Main navigation",
        "office": "Office:\n \n3151 Marine Biotech",
        "interests": null,
        "bio": "",
        "website": "https://undergrad.biology.ucsb.edu/",
        "fullText": "Skip to main content\nMain navigation\nAbout\nPeople\nResearch\nAcademics \nNews\nEvents\nSupport \nGive\nPeople  Faculty\nDébora Iglesias-Rodriguez\nProfessor\nPhone:\n \n805.893.4680\nEmail:\n \niglesias@lifesci.ucsb.edu\nOffice:\n \n3151 Marine Biotech\nWebsite:\n \nIglesias-Rodriguez Lab\nAreas of Research\nAquatic Biology\nBiological Oceanography\nEcological and Evolutionary Physiology\nEcology\nEcosystem Ecology\nMarine Biology\nMicrobial Ecology\nPopulation and Community Ecology\nBiography\n\nDebora Iglesias-Rodriguez is a biological oceanographer with a broad interest in mechanisms controlling diversity and function in marine biota. She has a B.Sc. in Biology & Biochemistry (Univ. Santiago de Compostela (Spain). After her PhD (1996) on carbon utilization in phytoplankton (Swansea Univ., U.K.), she was awarded a NERC Fellowship to study genetic diversity in coccolithophores (Bristol Univ., U.K.), and a NASA Fellowship to model their distribution using satellite data (Rutgers Univ., USA). Until December 2012, she ran a research group at the National Oceanography Centre (Southampton, U.K.), focusing on marine bioluminescence and the effect of ocean acidification on marine plankton.\n\nResearch\n\nDebora Iglesias-Rodriguez has worked for twenty years on diversity and function in marine phytoplankton combining molecular approaches, carbon physiology and biogeochemistry in the lab and in the field. Her team has been working on identifying mechanisms controlling plankton calcification under rising carbon dioxide (CO2) scenarios [ocean acidification (OA)]. This is important at a time when we are witnessing the fastest rate of change in CO2 that the Earth has seen for the past 65 million years. The big questions are: (1) which organisms will be resilient to rising CO2?; (2) how will the physiology of the organisms that adapt will change?; and (3) how will these physiological changes alter marine biogeochemical cycles? She has contributed to several white papers on OA, was a speaker at the 2011 IPCC worksho"
      }
    },
    {
      "name": "Anna James",
      "url": "https://www.eemb.ucsb.edu/people/faculty/james-0",
      "status": 200,
      "data": {
        "email": "ajames@ucsb.edu",
        "phone": "805.893.2974",
        "title": "Main navigation",
        "office": "Office:",
        "interests": null,
        "bio": "",
        "website": "https://undergrad.biology.ucsb.edu/",
        "fullText": "Skip to main content\nMain navigation\nAbout\nPeople\nResearch\nAcademics \nNews\nEvents\nSupport \nGive\nPeople  Faculty\nAnna James\nAssistant Teaching Professor\nEmail:\n \najames@ucsb.edu\nOffice:\n \nResearch\n\nHow students think and learn in large, introductory STEM courses and the effects of climate change on marine microbial communities\n\nContact Us\n 805.893.2974\n info@eemb.ucsb.edu\n Jobs\n Visit EEMB\nSupport Services\n Administration\n Room Reservations\n Research Services\nTechnical Support\nShipping / Receiving\nWebsite\n Information\n Terms of Use\n Privacy\n Login\n  \n\nEcology, Evolution, and Marine Biology\nUniversity of California, Santa Barbara\n© 2025 Regents of the University of California"
      }
    },
    {
      "name": "Andrea Jorgensen",
      "url": "https://www.eemb.ucsb.edu/people/staff/jorgensen",
      "status": 200,
      "data": {
        "email": "andrea.jorgensen@lifesci.ucsb.edu",
        "phone": "805.893.2974",
        "title": "Main navigation",
        "office": "Office:\n \n4306 Life Sciences Building",
        "interests": null,
        "bio": "",
        "website": "https://undergrad.biology.ucsb.edu/",
        "fullText": "Skip to main content\nMain navigation\nAbout\nPeople\nResearch\nAcademics \nNews\nEvents\nSupport \nGive\nPeople  Staff\nAndrea Jorgensen\nManagement Services Officer\nPhone:\n \n805.893.2974\nEmail:\n \nandrea.jorgensen@lifesci.ucsb.edu\nOffice:\n \n4306 Life Sciences Building\nJob Duties\n\nOversees the departmental operation and is responsible for it running smoothly.\n\nRelated Pages\nAdministration\nStaff Personnel & Payroll\nConference Room Reservations\nFacilities & Operations\nAcademic Personnel\nContact Us\n 805.893.2974\n info@eemb.ucsb.edu\n Jobs\n Visit EEMB\nSupport Services\n Administration\n Room Reservations\n Research Services\nTechnical Support\nShipping / Receiving\nWebsite\n Information\n Terms of Use\n Privacy\n Login\n  \n\nEcology, Evolution, and Marine Biology\nUniversity of California, Santa Barbara\n© 2025 Regents of the University of California"
      }
    },
    {
      "name": "Armand Kuris",
      "url": "https://www.eemb.ucsb.edu/people/faculty/kuris",
      "status": 200,
      "data": {
        "email": "kuris@lifesci.ucsb.edu",
        "phone": "805.893.3998",
        "title": "Main navigation",
        "office": "Office:\n \n2002 Marine Biotech",
        "interests": null,
        "bio": "",
        "website": "https://undergrad.biology.ucsb.edu/",
        "fullText": "Skip to main content\nMain navigation\nAbout\nPeople\nResearch\nAcademics \nNews\nEvents\nSupport \nGive\nPeople  Faculty\nArmand Kuris\nProfessor\nPhone:\n \n805.893.3998\nEmail:\n \nkuris@lifesci.ucsb.edu\nOffice:\n \n2002 Marine Biotech\nWebsite:\n \nParasite Ecology Group\nPublications Link:\n \nGoogle Scholar\nAreas of Research\nAquatic Biology\nDisease Ecology\nEcology\nEcosystem Ecology\nEvolutionary Ecology\nMarine Biology\nOrganismal Biology\nPopulation and Community Ecology\nZoology\nResearch\n\nOur laboratory is engaged in four interlocking areas of research. The underlying theory being developed in our lab concerns the nature of adaptive peaks for different types of trophic interactions (links in the food web; predator/prey, parasite/host). This theory expands the concept of parasitic castration as a distinct type of trophic phenomenon. In our lab, this work has had many spin-offs concerning interactions between larval trematodes, the impact of parasites on fisheries, and the development of biological control for marine pests, as well as human schistosomaisis.\n\nMost of our field work is done in salt marshes using a speciose guild of larval trematode parasitic castrators. These parasitic castrators are strong interactors in the snail first intermediate host. Thus, we are examining the relationship between the parasites in the first and second intermediate hosts. The relative vagility of the second intermediate host effectively integrates the spatial patches of the first intermediate host. Among our recent findings is the ability to sample the water column and to collect and identify the abundant cercarial larvae. We are using molecular tools to test the hypothesis that transmission from host to host integrates spatial heterogeneity. At the largest scale, we propose that movement of the final host (birds) produces some of the most widely distributed species known. In addition, we are developing in vitro competition studies to examine competitive dominance and taming of the life cycle of a larval"
      }
    },
    {
      "name": "Ryan Langlo",
      "url": "https://www.eemb.ucsb.edu/people/staff/langlo",
      "status": 200,
      "data": {
        "email": "ryan.langlo@lifesci.ucsb.edu",
        "phone": "(805) 893-7286",
        "title": "Main navigation",
        "office": "Office:\n \n1250A Bio Shop",
        "interests": null,
        "bio": "",
        "website": "https://undergrad.biology.ucsb.edu/",
        "fullText": "Skip to main content\nMain navigation\nAbout\nPeople\nResearch\nAcademics \nNews\nEvents\nSupport \nGive\nPeople  Staff\nRyan Langlo\nShop Superintendent\nPhone:\n \n(805) 893-7286\nEmail:\n \nryan.langlo@lifesci.ucsb.edu\nOffice:\n \n1250A Bio Shop\nJob Duties\n\nAssists with scientific equipment repair, research apparatus fabrication, and maintenance of departmental equipment.\n\nRelated Pages\nEEMB Shop\nContact Us\n 805.893.2974\n info@eemb.ucsb.edu\n Jobs\n Visit EEMB\nSupport Services\n Administration\n Room Reservations\n Research Services\nTechnical Support\nShipping / Receiving\nWebsite\n Information\n Terms of Use\n Privacy\n Login\n  \n\nEcology, Evolution, and Marine Biology\nUniversity of California, Santa Barbara\n© 2025 Regents of the University of California"
      }
    },
    {
      "name": "Saru Lantier",
      "url": "https://www.eemb.ucsb.edu/people/staff/lantier",
      "status": 200,
      "data": {
        "email": "info@eemb.ucsb.edu",
        "phone": "805.893.xxxxx",
        "title": "Main navigation",
        "office": "Office:\n \nBSIF 2219",
        "interests": null,
        "bio": "",
        "website": "https://undergrad.biology.ucsb.edu/",
        "fullText": "Skip to main content\nMain navigation\nAbout\nPeople\nResearch\nAcademics \nNews\nEvents\nSupport \nGive\nPeople  Staff\nSaru Lantier\nLab Coordinator\nPhone:\n \n805.893.xxxxx\nOffice:\n \nBSIF 2219\nContact Us\n 805.893.2974\n info@eemb.ucsb.edu\n Jobs\n Visit EEMB\nSupport Services\n Administration\n Room Reservations\n Research Services\nTechnical Support\nShipping / Receiving\nWebsite\n Information\n Terms of Use\n Privacy\n Login\n  \n\nEcology, Evolution, and Marine Biology\nUniversity of California, Santa Barbara\n© 2025 Regents of the University of California"
      }
    },
    {
      "name": "John Latto",
      "url": "https://www.eemb.ucsb.edu/people/faculty/latto",
      "status": 200,
      "data": {
        "email": "jlatto@ucsb.edu",
        "phone": "805.893.5399",
        "title": "Main navigation",
        "office": "Office:\n \n4324 Life Sciences Building",
        "interests": null,
        "bio": "",
        "website": "https://undergrad.biology.ucsb.edu/",
        "fullText": "Skip to main content\nMain navigation\nAbout\nPeople\nResearch\nAcademics \nNews\nEvents\nSupport \nGive\nPeople  Faculty\nJohn Latto\nSenior Lecturer\nPhone:\n \n805.893.5399\nEmail:\n \njlatto@ucsb.edu\nOffice:\n \n4324 Life Sciences Building\nResearch\n\nPopulation and community ecology; host-parasitoid interactions.\n\nContact Us\n 805.893.2974\n info@eemb.ucsb.edu\n Jobs\n Visit EEMB\nSupport Services\n Administration\n Room Reservations\n Research Services\nTechnical Support\nShipping / Receiving\nWebsite\n Information\n Terms of Use\n Privacy\n Login\n  \n\nEcology, Evolution, and Marine Biology\nUniversity of California, Santa Barbara\n© 2025 Regents of the University of California"
      }
    },
    {
      "name": "Sally MacIntyre",
      "url": "https://www.eemb.ucsb.edu/people/faculty/macintyre",
      "status": 200,
      "data": {
        "email": "sally@eri.ucsb.edu",
        "phone": "805.893.3951",
        "title": "Main navigation",
        "office": "Office:\n \n4308 Marine Science Institute",
        "interests": null,
        "bio": "",
        "website": "https://undergrad.biology.ucsb.edu/",
        "fullText": "Skip to main content\nMain navigation\nAbout\nPeople\nResearch\nAcademics \nNews\nEvents\nSupport \nGive\nPeople  Faculty\nSally MacIntyre\nProfessor\nPhone:\n \n805.893.3951\nEmail:\n \nsally@eri.ucsb.edu\nOffice:\n \n4308 Marine Science Institute\nPublications Link:\n \nGoogle Scholar\nAreas of Research\nAquatic Biology\nEcology\nEcosystem Ecology\nLimnology\nBiography\n\nSally MacIntyre attended Duke University (B.A. in Zoology, Ph.D. in Zoology with a minor in Mechanical Engineering), held a National Needs Postdoctoral Fellowship at UCSB in 1981, and was a Professional Researcher from 1982 -2004. In 2004 she joined the faculty at UCSB in the Department of Ecology, Evolution and Marine Biology. During her career, she has studied lakes from the tropics to the poles and participated in research cruises in coastal California and Antarctica.\n\nResearch\n\nMy research investigates physical processes in lakes and the coastal zone and their biogeochemical and ecological consequences. Studies are ongoing in Arctic and Subarctic lakes, Mono Lake, CA, tropical lakes in East Africa and the Amazon Basin, and the waters of coastal California.\n\nOur recent limnological research has illustrated the importance of instabilities of non-linear internal waves for turbulence production in the thermocline near the boundaries of lakes and resulting nutrient and gas fluxes. We have also quantified turbulence at the air-water interface due to changes in rates of heating and cooling and differences in wind speed. With this information we are developing new models of the gas transfer coefficient as needed for accurate estimates of regional and global carbon fluxes. Our goal is to extend our understandings of physical-biological coupling in individual lakes to the landscape scale using dmensionless indices and by establishing links to larger scale climate.\n\nContact Us\n 805.893.2974\n info@eemb.ucsb.edu\n Jobs\n Visit EEMB\nSupport Services\n Administration\n Room Reservations\n Research Services\nTechnical Support\nShipping / Receivin"
      }
    },
    {
      "name": "Haley Martin",
      "url": "https://www.eemb.ucsb.edu/people/staff/martin",
      "status": 200,
      "data": {
        "email": "haleymartin@ucsb.edu",
        "phone": "805-893-2427",
        "title": "Main navigation",
        "office": "Office:\n \n4308 Life Sciences Building",
        "interests": null,
        "bio": "",
        "website": "https://undergrad.biology.ucsb.edu/",
        "fullText": "Skip to main content\nMain navigation\nAbout\nPeople\nResearch\nAcademics \nNews\nEvents\nSupport \nGive\nPeople  Staff\nHaley Martin\nDirector of Finance\nPhone:\n \n805-893-2427\nEmail:\n \nhaleymartin@ucsb.edu\nOffice:\n \n4308 Life Sciences Building\nJob Duties\nResponsible for finance administration, payroll, non-academic personnel, recharges, & accounts payable.\nRelated Pages\nFinance & Procurement\nReimbursements\nStaff Personnel & Payroll\nContact Us\n 805.893.2974\n info@eemb.ucsb.edu\n Jobs\n Visit EEMB\nSupport Services\n Administration\n Room Reservations\n Research Services\nTechnical Support\nShipping / Receiving\nWebsite\n Information\n Terms of Use\n Privacy\n Login\n  \n\nEcology, Evolution, and Marine Biology\nUniversity of California, Santa Barbara\n© 2025 Regents of the University of California"
      }
    },
    {
      "name": "Jesús Martínez-Gómez",
      "url": "https://www.eemb.ucsb.edu/people/faculty/martinez-gomez",
      "status": 200,
      "data": {
        "email": "jesusgm@ucsb.edu",
        "phone": "805.893.2974",
        "title": "Main navigation",
        "office": null,
        "interests": null,
        "bio": "",
        "website": "https://undergrad.biology.ucsb.edu/",
        "fullText": "Skip to main content\nMain navigation\nAbout\nPeople\nResearch\nAcademics \nNews\nEvents\nSupport \nGive\nPeople  Faculty\nJesús Martínez-Gómez\nAssistant Professor\nEmail:\n \njesusgm@ucsb.edu\nWebsite:\n \nLab Site\nAreas of Research\nBotany\nEvolution\nEvolutionary Genetics\nMacroevolution\nOrganismal Biology\nBiography\nJesús Martínez-Gómez is from Ferndale, Washington. He earned his B.S. in Molecular, Cellular, and Developmental Biology from the University of Washington. At UW, he joined the lab of Dr. Verónica Di Stilio, where he became fascinated by the diversity of plant forms and learned how to be a scientist. He was supported by the Society of Developmental Biology's Choose Development program and the McNair Scholars Program, both which helped him gain admission to graduate school. He completed his Ph.D. in Plant Biology at Cornell University in the lab of Dr. Chelsea Specht. There, he continued to study plant diversity, developing an interest in inflorescences (flowering branches) and phylogenetic comparative methods. He conducted postdoctoral research at the University of California, Berkeley, as both an NSF Postdoctoral Fellow in Biology and a UC President’s Postdoctoral Fellow, working in the lab of Dr. Benjamin Blackman with co-advising from Dr. Yun Song. His research focuses on the developmental genetic basis of two important life history traits in monkeyflowers: floral ultraviolet pigmentation patterns and cold tolerance plasticity.\nResearch\n\nA key goal in biology is to link genotypic variation to phenotypic variation. While significant progress has been made for many plant structures and species, we still lack a predictive framework for linking genotype to phenotype across diverse lineages. Using an evo-devo approach, we ask: how do phenotypes mechanistically arise from genotypes at the individual level? Using a phylogenetic comparative framework, we ask: how have traits evolved and contributed to species diversification? Our current research focuses on two interrelated are"
      }
    },
    {
      "name": "Susan J. Mazer",
      "url": "https://www.eemb.ucsb.edu/people/faculty/mazer",
      "status": 200,
      "data": {
        "email": "sjmazer@ucsb.edu",
        "phone": "805.893.8011",
        "title": "Main navigation",
        "office": "Office:\n \n4119 Life Sciences Building",
        "interests": null,
        "bio": "",
        "website": "https://undergrad.biology.ucsb.edu/",
        "fullText": "Skip to main content\nMain navigation\nAbout\nPeople\nResearch\nAcademics \nNews\nEvents\nSupport \nGive\nPeople  Faculty\nSusan J. Mazer\nProfessor\nPhone:\n \n805.893.8011\nEmail:\n \nsjmazer@ucsb.edu\nOffice:\n \n4119 Life Sciences Building\nWebsite:\n \nSusan Mazer Lab\nPublications Link:\n \nGoogle Scholar\nAreas of Research\nBotany\nEcology\nEvolution\nEvolutionary Ecology\nEvolutionary Genetics\nOrganismal Biology\nPopulation and Community Ecology\nBiography\n\n1981; B.S. Biology; Yale University; New Haven, Connecticut\n1983; M.S. Botany; University of California, Davis\n1986; Ph.D. Botany; University of California, Davis\n\nResearch\n\nMy research aims to detect the mechanisms by which plants adapt to the ecological risks and opportunities that they encounter, and to explore the genetic constraints that may limit the rate or degree of adaptation. We integrate the tools of quantitative genetics; comparative biology; artificial selection; plant demography, pollination, and phenology; fluorescence microscopy of reproductive functions; and ecophysiological surveys.\n\nOur central goals are to determine genetic and environmental sources of variation in traits that affect individual fitness. To understand the evolutionary significance of this variation, we also examine the fitness consequences of traits — singly and in combination — under natural conditions. The combination of genetic, morphological, and physiological approaches also allows the detection of potential evolutionary constraints (e.g., due to pleiotropy or strong genetic correlations) that can impede the evolution of individual traits that may otherwise be under strong natural selection.\n\nContact Us\n 805.893.2974\n info@eemb.ucsb.edu\n Jobs\n Visit EEMB\nSupport Services\n Administration\n Room Reservations\n Research Services\nTechnical Support\nShipping / Receiving\nWebsite\n Information\n Terms of Use\n Privacy\n Login\n  \n\nEcology, Evolution, and Marine Biology\nUniversity of California, Santa Barbara\n© 2025 Regents of the University of California"
      }
    },
    {
      "name": "Douglas McCauley",
      "url": "https://www.eemb.ucsb.edu/people/faculty/mccauley",
      "status": 200,
      "data": {
        "email": "dmccauley@ucsb.edu",
        "phone": "805.893.2170",
        "title": "Main navigation",
        "office": "Office:\n \n2314 Marine Science Institute",
        "interests": null,
        "bio": "",
        "website": "https://undergrad.biology.ucsb.edu/",
        "fullText": "Skip to main content\nMain navigation\nAbout\nPeople\nResearch\nAcademics \nNews\nEvents\nSupport \nGive\nPeople  Faculty\nDouglas McCauley\nProfessor\nPhone:\n \n805.893.2170\nEmail:\n \ndmccauley@ucsb.edu\nOffice:\n \n2314 Marine Science Institute\nWebsite:\n \nMcCauley Lab\nPublications Link:\n \nGoogle Scholar\nAreas of Research\nBehavior\nEcosystem Ecology\nMarine Biology\nPopulation and Community Ecology\nZoology\nBiography\nB.A. - University of California at Berkeley, Integrative Biology\nB.A. - University of California at Berkeley, Political Science\nPhD - Stanford University, Biology/Hopkins Marine Station\nNSF IRFP Postdoctoral Fellow - University of California at Berkeley, Environmental Science, Policy, and Management\nPostdoctoral Research – Stanford University, Hopkins Marine Station\nResearch\n\nUnderstanding the ecology of communities and ecosystems in a rapidly changing world.\n\nIn the McCauley Lab we use a diverse suite of methods to answer pressing questions in community and ecosystem ecology. Research in the lab is directed at understanding how community structure influences ecosystem dynamics, in determining how ecosystems are interactively and energetically coupled to one another, and quantifying how humans perturb these dynamics and shape patterns of biodiversity. We engage these questions using tools from the disciplines of community ecology, biogeochemistry, spatial analysis, ecological modeling, conservation biology, and anthropology. An important aim of research in the McCauley Lab is to generate results that both advance the pure science of ecology and that can be of practical service to decision makers responsible for shaping the future of our environment. We conduct research in a variety of ecological contexts (e.g. coral reefs, tropical savannas, Californian ecosystems) pursuing the philosophy that first principles in ecology can be most effectively derived via observation of pattern and process in diverse settings.\n\nContact Us\n 805.893.2974\n info@eemb.ucsb.edu\n Jobs\n Visit EEMB"
      }
    },
    {
      "name": "Holly Moeller",
      "url": "https://www.eemb.ucsb.edu/people/faculty/moeller",
      "status": 200,
      "data": {
        "email": null,
        "phone": null,
        "title": null,
        "office": null,
        "interests": null,
        "bio": null,
        "website": "https://moellerlab.org/values/",
        "fullText": "Whiteboards in the wet lab\n\nThe Moeller Lab studies acquired metabolism. When organisms acquire metabolism (i.e., gain access to metabolic pathways that aren’t hard-wired into their own DNA), they fundamentally change their ability to interact with the living and non-living components of their environment. Examples of acquired metabolism surround us: bacteria gain antibiotic resistance by incorporating DNA from their environment; corals gain the capacity to turn sunlight into energy by incorporating algal endosymbionts. Even we humans, with our vast complement of gut microbiota, benefit by playing temporary host to other metabolisms.\n\nOur lab uses a combination of mathematical models, field observations, and lab experiments to figure out how acquired metabolism changes the dynamics of living communities and understand what ecological pressures lead to the evolution and maintenance of these acquisitions. We work in systems as diverse as tree-fungal symbioses in forests, and chloroplast-stealing ciliates in the coastal ocean!\n\nWe are evolutionary ecologists, biological oceanographers, and mathematical biologists. We draw inspiration from natural history, and translate our observations into mathematical equations. These equations invariably yield hypotheses that can (sometimes) be tested with field data or lab experiments.\n\nWe are committed to maintaining a supportive, inclusive atmosphere that fosters a diversity of ideas and approaches in community ecology, biological oceanography, and theoretical ecology. Read more about our values here.\n\n<<Top Image: Mile Rock Beach, San Francisco, CA, January 2013>>\n\nShare this:\n X Facebook"
      }
    },
    {
      "name": "Alice Nguyen",
      "url": "https://www.eemb.ucsb.edu/people/staff/nguyen",
      "status": "error",
      "error": "page.goto: Timeout 20000ms exceeded.\nCall log:\n  - navigating to \"https://www.eemb.ucsb.edu/people/staff/nguyen\", waiting until \"networkidle\"\n"
    },
    {
      "name": "Nick Nidzieko",
      "url": "https://www.eemb.ucsb.edu/people/faculty/nidzieko",
      "status": 200,
      "data": {
        "email": "nidzieko@ucsb.edu",
        "phone": "+1 805-893-5674",
        "title": "Main navigation",
        "office": "Office:\n \n4316 MSRB / 5830 Ellison Hall",
        "interests": null,
        "bio": "",
        "website": "https://undergrad.biology.ucsb.edu/",
        "fullText": "Skip to main content\nMain navigation\nAbout\nPeople\nResearch\nAcademics \nNews\nEvents\nSupport \nGive\nPeople  Faculty\nNick Nidzieko\nChair, IGPMS Earth Science\nAssociate Professor\nPhone:\n \n+1 805-893-5674\nEmail:\n \nnidzieko@ucsb.edu\nOffice:\n \n4316 MSRB / 5830 Ellison Hall\nBiography\n\nDr. Nidzieko earned his B.S. in Marine Biology from UCLA and both an M.S. and Ph.D. in Environmental Fluid Mechanics from Stanford University. Following postdoctoral work at WHOI, he joined the faculty of the University of Maryland Center for Environmental Science at Horn Point Laboratory. He joined UCSB in 2016.\n\nResearch\n\nI am a coastal physical oceanographer. My research focuses on how physical processes affect marine ecosystems, through novel measurements using autonomous platforms and emerging sensor technologies. I am interested the dynamics of estuaries, kelp forests, and the Santa Barbara Channel.\n\nContact Us\n 805.893.2974\n info@eemb.ucsb.edu\n Jobs\n Visit EEMB\nSupport Services\n Administration\n Room Reservations\n Research Services\nTechnical Support\nShipping / Receiving\nWebsite\n Information\n Terms of Use\n Privacy\n Login\n  \n\nEcology, Evolution, and Marine Biology\nUniversity of California, Santa Barbara\n© 2025 Regents of the University of California"
      }
    },
    {
      "name": "Michael (Mickey) O'Connell",
      "url": "https://www.eemb.ucsb.edu/people/staff/oconnell",
      "status": 200,
      "data": {
        "email": "michael.oconnell@lifesci.ucsb.edu",
        "phone": "805.893.7181",
        "title": "Main navigation",
        "office": "Office:\n \n1007 Marine Biotech",
        "interests": null,
        "bio": "",
        "website": "https://undergrad.biology.ucsb.edu/",
        "fullText": "Skip to main content\nMain navigation\nAbout\nPeople\nResearch\nAcademics \nNews\nEvents\nSupport \nGive\nPeople  Staff\nMichael (Mickey) O'Connell\nMarine Mechanician\nPhone:\n \n805.893.7181\nEmail:\n \nmichael.oconnell@lifesci.ucsb.edu\nOffice:\n \n1007 Marine Biotech\nJob Duties\n\nResponsible for the daily upkeep of departmental boats, research equipment maintenance and repair, facilities management, and design and construction services.\n\nRelated Pages\nMarine Operations\nContact Us\n 805.893.2974\n info@eemb.ucsb.edu\n Jobs\n Visit EEMB\nSupport Services\n Administration\n Room Reservations\n Research Services\nTechnical Support\nShipping / Receiving\nWebsite\n Information\n Terms of Use\n Privacy\n Login\n  \n\nEcology, Evolution, and Marine Biology\nUniversity of California, Santa Barbara\n© 2025 Regents of the University of California"
      }
    },
    {
      "name": "Todd Oakley",
      "url": "https://www.eemb.ucsb.edu/people/faculty/oakley",
      "status": 200,
      "data": {
        "email": "oakley@ucsb.edu",
        "phone": "805.893.4715",
        "title": "Main navigation",
        "office": "Office:\n \n4101 Life Sciences Building",
        "interests": null,
        "bio": "",
        "website": "https://undergrad.biology.ucsb.edu/",
        "fullText": "Skip to main content\nMain navigation\nAbout\nPeople\nResearch\nAcademics \nNews\nEvents\nSupport \nGive\nPeople  Faculty\nTodd Oakley\nEEMB Department Chair\nProfessor\nPhone:\n \n805.893.4715\nEmail:\n \noakley@ucsb.edu\nOffice:\n \n4101 Life Sciences Building\nWebsite:\n \nOakley Lab\nPublications Link:\n \nGoogle Scholar\nAreas of Research\nAquatic Biology\nBehavior\nEcological and Evolutionary Physiology\nEvolution\nEvolutionary Ecology\nEvolutionary Genetics\nMacroevolution\nMarine Biology\nOrganismal Biology\nZoology\nBiography\n\nTodd Oakley is an evolutionary biologist and professor in the EEMB Department at the University of California, Santa Barbara. Dr. Oakley earned a BS and MS from the University of Wisconsin-Milwaukee and his PhD in Biological Sciences from Duke University. He was an NIH-NRSA postdoctoral fellow at the University of Chicago. He joined the EEMB faculty in 2003. Dr. Oakley currently serves as Vice Chair of resources for EEMB, and he is a member of UCSB’s Marine Science Institute. He is the PI or Co-PI on multiple federally funded research projects in evolution, ecology, and genomics.\n\nResearch\nWe currently (as of October 2012) are following four main research paths:\nOrigins of vision and light interaction genes: Eyes and vision are often considered mind-bogglingly complex, begging the question of how evolution could have produced them. We are addressing this question by examining the components of eyes and vision in a phylogenetic context, to trace those components to their very origins. This has led to behavioral studies in Cnidaria and a chytrid fungus.\nEvolution of arthropod eyes. Arthropods have more types of eye design that any other phylum. How and why did this diversity arise? We are combining a variety of tools and approaches from high throughput sequencing to phylogenetics to behavioral studies in order to understand how there is so much variation in arthropod eyes. In particular we are studying ostracod crustaceans, including a group where only males have eyes.\nEvolut"
      }
    },
    {
      "name": "Ryoko Oono",
      "url": "https://www.eemb.ucsb.edu/people/faculty/oono",
      "status": 200,
      "data": {
        "email": "ryoko.oono@lifesci.ucsb.edu",
        "phone": "805.893.5064",
        "title": "Main navigation",
        "office": "Office:\n \n1116 Noble Hall",
        "interests": null,
        "bio": "",
        "website": "https://undergrad.biology.ucsb.edu/",
        "fullText": "Skip to main content\nMain navigation\nAbout\nPeople\nResearch\nAcademics \nNews\nEvents\nSupport \nGive\nPeople  Faculty\nRyoko Oono\nAssociate Professor\nPhone:\n \n805.893.5064\nEmail:\n \nryoko.oono@lifesci.ucsb.edu\nOffice:\n \n1116 Noble Hall\nWebsite:\n \nRyoko Oono Lab\nPublications Link:\n \nGoogle Scholar\nAreas of Research\nBotany\nEvolutionary Ecology\nEvolutionary Genetics\nMicrobial Ecology\nPopulation and Community Ecology\nBiography\n\nRyoko Oono is an evolutionary ecologist focusing on plant-microbe interactions. Dr. Oono earned her BA degree at Carleton College and her PhD in plant biology at the University of Minnesota where she studied the evolutionary stability of the legume-rhizobia symbiosis. As a postdoctoral fellow of NIH’s Molecular Mycology and Pathogenesis Training Program at Duke University and NC State University, she studied foliar fungal endophytes and their relationship with pine hosts in southeastern U.S.\n\nResearch\n\nResearch in the Oono Lab is focused on understanding how symbiotic associations evolve, particularly between plant hosts or communities and bacterial or fungal microbes. Her lab uses observational approaches with various genetic tools (population genetics, community genetics, systematics, biogeography) as well as experimental approaches by manipulating microbial phenotypes, microbial or host communities, or the environment. Model systems currently studied are the ecologically important legume-rhizobia symbioses and the ubiquitous and highly diverse foliar fungal endophytes found in all major lineages of plants.\n\nContact Us\n 805.893.2974\n info@eemb.ucsb.edu\n Jobs\n Visit EEMB\nSupport Services\n Administration\n Room Reservations\n Research Services\nTechnical Support\nShipping / Receiving\nWebsite\n Information\n Terms of Use\n Privacy\n Login\n  \n\nEcology, Evolution, and Marine Biology\nUniversity of California, Santa Barbara\n© 2025 Regents of the University of California"
      }
    },
    {
      "name": "Christian Orsini",
      "url": "https://www.eemb.ucsb.edu/people/staff/orsini",
      "status": 200,
      "data": {
        "email": "christian.orsini@lifesci.ucsb.edu",
        "phone": "805.893.2873",
        "title": "Main navigation",
        "office": "Office:\n \n102 Building 465",
        "interests": null,
        "bio": "",
        "website": "https://undergrad.biology.ucsb.edu/",
        "fullText": "Skip to main content\nMain navigation\nAbout\nPeople\nResearch\nAcademics \nNews\nEvents\nSupport \nGive\nPeople  Staff\nChristian Orsini\nAssistant Diver / Collector\nPhone:\n \n805.893.2873\nEmail:\n \nchristian.orsini@lifesci.ucsb.edu\nOffice:\n \n102 Building 465\nJob Duties\n\nResponsible for animal collections and care, facilities operations and maintenance, and captaining departmental boats.\n\nContact Us\n 805.893.2974\n info@eemb.ucsb.edu\n Jobs\n Visit EEMB\nSupport Services\n Administration\n Room Reservations\n Research Services\nTechnical Support\nShipping / Receiving\nWebsite\n Information\n Terms of Use\n Privacy\n Login\n  \n\nEcology, Evolution, and Marine Biology\nUniversity of California, Santa Barbara\n© 2025 Regents of the University of California"
      }
    },
    {
      "name": "Oscar Perez",
      "url": "https://www.eemb.ucsb.edu/people/staff/perez",
      "status": 200,
      "data": {
        "email": "info@eemb.ucsb.edu",
        "phone": "805.893.3357",
        "title": "Main navigation",
        "office": "Office:\n \n1118 Biological Sciences Instructional Facility",
        "interests": null,
        "bio": "",
        "website": "https://undergrad.biology.ucsb.edu/",
        "fullText": "Skip to main content\nMain navigation\nAbout\nPeople\nResearch\nAcademics \nNews\nEvents\nSupport \nGive\nPeople  Staff\nOscar Perez\nLab Manager\nPhone:\n \n805.893.3357\nOffice:\n \n1118 Biological Sciences Instructional Facility\nJob Duties\n\nManages the Introductory Biology Program laboratory courses.\n\nContact Us\n 805.893.2974\n info@eemb.ucsb.edu\n Jobs\n Visit EEMB\nSupport Services\n Administration\n Room Reservations\n Research Services\nTechnical Support\nShipping / Receiving\nWebsite\n Information\n Terms of Use\n Privacy\n Login\n  \n\nEcology, Evolution, and Marine Biology\nUniversity of California, Santa Barbara\n© 2025 Regents of the University of California"
      }
    },
    {
      "name": "Danielle Perez",
      "url": "https://www.eemb.ucsb.edu/people/staff/dcperez",
      "status": 200,
      "data": {
        "email": "dcperez@ucsb.edu",
        "phone": "805.893.3775",
        "title": "Main navigation",
        "office": "Office:\n \n4316 Life Sciences Building",
        "interests": null,
        "bio": "",
        "website": "https://undergrad.biology.ucsb.edu/",
        "fullText": "Skip to main content\nMain navigation\nAbout\nPeople\nResearch\nAcademics \nNews\nEvents\nSupport \nGive\nPeople  Staff\nDanielle Perez\nDepartmental Assistant\nPhone:\n \n805.893.3775\nEmail:\n \ndcperez@ucsb.edu\nOffice:\n \n4316 Life Sciences Building\nRelated Pages\nInstructional Support\nContact Us\n 805.893.2974\n info@eemb.ucsb.edu\n Jobs\n Visit EEMB\nSupport Services\n Administration\n Room Reservations\n Research Services\nTechnical Support\nShipping / Receiving\nWebsite\n Information\n Terms of Use\n Privacy\n Login\n  \n\nEcology, Evolution, and Marine Biology\nUniversity of California, Santa Barbara\n© 2025 Regents of the University of California"
      }
    },
    {
      "name": "Ferdinand Pfab",
      "url": "https://www.eemb.ucsb.edu/people/researchers/pfab",
      "status": 200,
      "data": {
        "email": "ferdinand.pfab@gmail.com",
        "phone": "805.893.2974",
        "title": "Main navigation",
        "office": "Office:\n \n2003 Noble Hall",
        "interests": null,
        "bio": "",
        "website": "https://undergrad.biology.ucsb.edu/",
        "fullText": "Skip to main content\nMain navigation\nAbout\nPeople\nResearch\nAcademics \nNews\nEvents\nSupport \nGive\nPeople  Researchers\nFerdinand Pfab\nPostdoctoral Researcher\nEmail:\n \nferdinand.pfab@gmail.com\nOffice:\n \n2003 Noble Hall\nAdvisor\nCherie Briggs\nRoger Nisbet\n\nModeling biological systems: infections, evolution and population dynamics.\n\nContact Us\n 805.893.2974\n info@eemb.ucsb.edu\n Jobs\n Visit EEMB\nSupport Services\n Administration\n Room Reservations\n Research Services\nTechnical Support\nShipping / Receiving\nWebsite\n Information\n Terms of Use\n Privacy\n Login\n  \n\nEcology, Evolution, and Marine Biology\nUniversity of California, Santa Barbara\n© 2025 Regents of the University of California"
      }
    },
    {
      "name": "Christoph Pierre",
      "url": "https://www.eemb.ucsb.edu/people/staff/pierre",
      "status": 200,
      "data": {
        "email": "pierre@lifesci.ucsb.edu",
        "phone": "+1 805-893-2873",
        "title": "Main navigation",
        "office": null,
        "interests": null,
        "bio": "",
        "website": "https://marineops.eemb.ucsb.edu/boatshop",
        "fullText": "Skip to main content\nMain navigation\nHome\nOperations\nSafety\nPeople\nLocation\nWeather\nGallery\nVideo file\n UCSB Marine Operations\n\nThe UCSB Marine Operations is an education, research and training support system that is managed by a collaboration between the Ecology Evolution and Marine Biology Department (EEMB) and Environmental Health and Safety (EH&S). The Marine Ops provide equipment, logistics, training and experienced staff to the campus marine science community in the form of scientific boating and diving support, animal collections, biological/oceanographic design and fabrication, seawater infrastructure and research space. Faculty, staff, graduate and undergraduate student support is provided to insure safe and effective on-water and underwater activities both locally and at sites around the world.\n\n Logins\nBoat Calendar System\nWebdiver Tracking and Reporting\n Weather\n\nWeather links, models and resources.\n\nView More\nMarine Operations Facility\nDiving & Boating Safety\nOffice Locations\nMarineOps\n People\n +1 805-893-2873\n pierre@lifesci.ucsb.edu\nEH&S Safety\n People\n +1 805-893-4559\n eric.hessell@ehs.ucsb.edu\nWebsite\n Information\n Terms of Use\n Privacy\n\nUCSB Marine Operations • Ecology, Evolution, and Marine Biology • UC Santa Barbara\n2025 © Regents of the University of California"
      }
    },
    {
      "name": "Stephen Proulx",
      "url": "https://www.eemb.ucsb.edu/people/faculty/proulx",
      "status": 200,
      "data": {
        "email": "sproul@ucsb.edu",
        "phone": "805.893.2974",
        "title": "Main navigation",
        "office": "Office:\n \n4109 Life Sciences Building",
        "interests": null,
        "bio": "",
        "website": "https://undergrad.biology.ucsb.edu/",
        "fullText": "Skip to main content\nMain navigation\nAbout\nPeople\nResearch\nAcademics \nNews\nEvents\nSupport \nGive\nPeople  Faculty\nStephen Proulx\nEEMB Vice Chair, Curriculum\nProfessor\nEmail:\n \nsproul@ucsb.edu\nOffice:\n \n4109 Life Sciences Building\nWebsite:\n \nProulx Lab\nTwitter Link:\n \n@proulxstephen2\nPublications Link:\n \nGoogle Scholar\nAreas of Research\nBehavior\nEvolution\nEvolutionary Ecology\nEvolutionary Genetics\nBiography\n\nProfessor Proulx received a BA in Mathematics and Biology from UC Santa Cruz before going on for a PhD at the University of Utah. His graduate work focused on sexual selection, sex allocation, and mate choice. Postdoctoral work at the University of Toronto continued the theme of sexual selection and expanded to include studies of stochastic evolutionary dynamics. He then was an NIH NRSA postdoctoral fellow at the University of Oregon where he began his studies of gene network evolution, in particular on the strength of selection on canalization. He was a professor at Iowa State University for three years before moving to UCSB in 2008.\n\nResearch\n\nResearch in the Proulx lab uses mathematical and computational approaches to understand fundamental processes in evolutionary biology. We apply these methods to a wide range of biological phenomena. For example, why do females of many species choose mates based on showy display traits? What strategies do males use to determine how much energy and time should be devoted to attracting a mate? It turns out that we can use many of the same mathematical tools to study the evolution of strategies that play out at the genetic level. How should cells evaluate signals from the environment? How should they deal with signals from the environment that might not be accurate? Our current work focusses on the evolution of decision making gene networks that are the \"brains\" of single-celled organisms and play a role in signaling within higher organisms.\n\nContact Us\n 805.893.2974\n info@eemb.ucsb.edu\n Jobs\n Visit EEMB\nSupport Services\n Admin"
      }
    },
    {
      "name": "Joel Rothman",
      "url": "https://www.eemb.ucsb.edu/people/faculty/rothman",
      "status": 200,
      "data": {
        "email": "joel.rothman@lifesci.ucsb.edu",
        "phone": "805.893.7885",
        "title": "Main navigation",
        "office": "Office:\n \n3137 Bio II",
        "interests": null,
        "bio": "",
        "website": "https://undergrad.biology.ucsb.edu/",
        "fullText": "Skip to main content\nMain navigation\nAbout\nPeople\nResearch\nAcademics \nNews\nEvents\nSupport \nGive\nPeople  Faculty\nJoel Rothman\nProfessor\nPhone:\n \n805.893.7885\nEmail:\n \njoel.rothman@lifesci.ucsb.edu\nOffice:\n \n3137 Bio II\nWebsite:\n \nRothman Lab\nPublications Link:\n \nGoogle Scholar\nAreas of Research\nBehavior\nEcological and Evolutionary Physiology\nEvolution\nEvolutionary Genetics\nMacroevolution\nOrganismal Biology\nZoology\nBiography\n\nDr. Rothman earned his B.S. from the University of California, Davis in 1978 and was Winemaster at Buena Vista Winery, Sonoma until 1983. He earned his Ph.D. from the University of Oregon in 1988. As a Helen Hay Whitney fellow and an EMBO fellow at the Medical Research Council, Cambridge, England, he initiated genetic studies of embryonic development in the nematode Caenorhabditis elegans; these studies continue to be a major focus of his laboratory. He was a faculty member in the Department of Biochemistry, University of Wisconsin, Madison from 1991-96 and moved to UCSB in 1996 to return to his native California. He is also a member of the Neuroscience Research Institute and the Biomolecular Sciences and Engineering Program. He is the recipient of a Searle Scholars Award, and a Shaw Scientists Award and serves on the editorial board of the journal Developmental Biology, the journal Current Biology, and the journal Developmental Dynamics. He is a member of the Board of Trustees of the Cancer Center of Santa Barbara and a member of the International C. elegans Meeting Organizing Committee. From 2001-06, he was Co-director of the Woods Hole Marine Biological Laboratory Embryology Course and has also served as the Chair of the NIH Molecular Genetics B (MGB) Study Section, as a member of the Faculty of 1000, and on the editorial board of the journal Apoptosis.\n\nResearch\n\nRegulation of development and differentiation; regulation of programmed cell death and cell division; mechanisms of tumorigenesis\n\nWhen a fertilized egg is transformed into a complex"
      }
    },
    {
      "name": "Alyson Santoro",
      "url": "https://www.eemb.ucsb.edu/people/faculty/santoro",
      "status": 200,
      "data": {
        "email": "asantoro@ucsb.edu",
        "phone": "805.893.5318",
        "title": "Main navigation",
        "office": "Office:\n \n2155 Marine Biotech Lab",
        "interests": null,
        "bio": "",
        "website": "https://undergrad.biology.ucsb.edu/",
        "fullText": "Skip to main content\nMain navigation\nAbout\nPeople\nResearch\nAcademics \nNews\nEvents\nSupport \nGive\nPeople  Faculty\nAlyson Santoro\nProfessor\nPhone:\n \n805.893.5318\nEmail:\n \nasantoro@ucsb.edu\nOffice:\n \n2155 Marine Biotech Lab\nWebsite:\n \nSantoro Research Group\nPublications Link:\n \nGoogle Scholar\nAreas of Research\nBiological Oceanography\nEcosystem Ecology\nEvolutionary Ecology\nMicrobial Ecology\nPopulation and Community Ecology\nBiography\n\nSantoro received her B.A. from Dartmouth College in Ecology and Evolutionary Biology, and her M.S. and Ph.D. from Stanford University in Environmental Engineering. Following a postdoctoral fellowship at Woods Hole Oceanographic Institution, she was a faculty member at the University of Maryland Center for Environmental Science before joining the faculty at UCSB. She is the recipient of a Sloan Foundation Early Career Fellowship and is a Simons Foundation Early Career Investigator in Marine Microbial Ecology.\n\nResearch\n\nMy research focuses on microbes involved in nutrient cycling in the ocean, especially of the element nitrogen. I am interested in cultivating new microbes and discovering novel ways of tracking their activity. This research combines laboratory experiments with field observations, and to date has used genomics, transcriptomics, proteomics and stable isotope geochemistry as tools to uncover the activity of microbes in the mesopelagic ocean. A particular focus of the lab is the marine archaea, a largely uncultured group of microbes. Findings from our recent research include the discovery that archaea in the ocean can make the greenhouse gas nitrous oxide, and that some marine archaea have exceptionally small genomes.\n\nContact Us\n 805.893.2974\n info@eemb.ucsb.edu\n Jobs\n Visit EEMB\nSupport Services\n Administration\n Room Reservations\n Research Services\nTechnical Support\nShipping / Receiving\nWebsite\n Information\n Terms of Use\n Privacy\n Login\n  \n\nEcology, Evolution, and Marine Biology\nUniversity of California, Santa Barbara\n© 2025 Reg"
      }
    },
    {
      "name": "Joshua Schimel",
      "url": "https://www.eemb.ucsb.edu/people/faculty/schimel",
      "status": 200,
      "data": {
        "email": "schimel@lifesci.ucsb.edu",
        "phone": "805.893.7688",
        "title": "Main navigation",
        "office": "Office:\n \n1108 Noble Hall",
        "interests": null,
        "bio": "",
        "website": "https://undergrad.biology.ucsb.edu/",
        "fullText": "Skip to main content\nMain navigation\nAbout\nPeople\nResearch\nAcademics \nNews\nEvents\nSupport \nGive\nPeople  Faculty\nJoshua Schimel\nProfessor\nPhone:\n \n805.893.7688\nEmail:\n \nschimel@lifesci.ucsb.edu\nOffice:\n \n1108 Noble Hall\nLab:\n \n1245 Noble Hall\nWebsite:\n \nSchimel Lab\nPublications Link:\n \nGoogle Scholar\nAreas of Research\nBotany\nEcology\nEcosystem Ecology\nMicrobial Ecology\nOrganismal Biology\nResearch\n\nMy research sits at the interface of ecosystem and microbial ecology. I am interested in the role of soil microbes in controlling ecosystem scale processes. I am particularly interested in the linkages between plant and soil processes, and how changes in microbial community structure affects ecosystem-scale dynamics. My work is now focusing on three ecosystems: the Arctic tundra in Alaska and Greenland, High elevation ecosystems in the Sierra Nevada, and the California annual grassland-oak savanna.\n\nWork in the Arctic is focused on understanding the dynamics of soil organic matter. The Arctic is important in global climate since there is a lot of C stored in arctic soils and the Arctic is warming faster than the rest of the world. Increased temperatures could cause greater release of C into the atmosphere, producing a positive feedback on global climate. Alternatively, nutrient release from soil organic matter could enhance plant growth, making the Arctic a stronger sink for atmospheric CO2, and producing a negative feedback on climate. Which of these processes is more important depends on the nature of soil organic matter, its bioavailability, and what happens to the nutrients that are made available by decomposition. Within this framework I have projects studying the bioavailability of tundra soil C and N and how that varies throughout the year.\n\nOne important piece of understanding the Arctic is winter. Winter is long and cold, but it is not biologically dead. Winter activity accounts for a significant portion of total annual respiration, and may account for all of the an"
      }
    },
    {
      "name": "Joel Sharbrough",
      "url": "https://www.eemb.ucsb.edu/people/faculty/sharbrough",
      "status": 200,
      "data": {
        "email": "jsharbro@ucsb.edu",
        "phone": "805-893-4432",
        "title": "Main navigation",
        "office": "Office:\n \n1123 Biological Sciences 2",
        "interests": null,
        "bio": "",
        "website": "https://undergrad.biology.ucsb.edu/",
        "fullText": "Skip to main content\nMain navigation\nAbout\nPeople\nResearch\nAcademics \nNews\nEvents\nSupport \nGive\nPeople  Faculty\nJoel Sharbrough\nAssistant Professor\nPhone:\n \n805-893-4432\nEmail:\n \njsharbro@ucsb.edu\nOffice:\n \n1123 Biological Sciences 2\nWebsite:\n \nSharbrough Lab\nPublications Link:\n \nGoogle Scholar\nAreas of Research\nEvolutionary Genetics\nEvolution\nBotany\nAquatic Biology\nEcological and Evolutionary Physiology\nOrganismal Biology\nZoology\nBiography\n\nI am an evolutionary biologist interested in the (co)evolution of genomes and their emergent cellular and organismal phenotypes, especially in the context of eukaryotic energy production. I am originally from Lake Tahoe, CA, but moved to the Midwest to attend the University of Notre Dame for my undergraduate degree. Next, I moved to Iowa City, IA for graduate school at the University of Iowa, where I was mentored by Dr. Maurine Neiman while studying the evolutionary maintenance of sexual reproduction. After graduate school, I moved to Fort Collins to work as a postdoc with Dr. Dan Sloan. There, I studied cytonuclear interactions of allopolyploids. I was an Assistant Professor of Biology at New Mexico Tech form 2020-2024, after which I moved my lab to the EEMB Department at UCSB. My lab investigates the genetic and evolutionary forces that affect mitochondrial and chloroplast function in both plants and animals. I am an avid outdoorsman, and especially enjoy convincing my family to hike just a little bit farther.\n\nResearch\n\nResearch Interests: Evolutionary genomics, polyploidy, mitochondria, chloroplasts, respiration, photosynthesis\n\nContact Us\n 805.893.2974\n info@eemb.ucsb.edu\n Jobs\n Visit EEMB\nSupport Services\n Administration\n Room Reservations\n Research Services\nTechnical Support\nShipping / Receiving\nWebsite\n Information\n Terms of Use\n Privacy\n Login\n  \n\nEcology, Evolution, and Marine Biology\nUniversity of California, Santa Barbara\n© 2025 Regents of the University of California"
      }
    },
    {
      "name": "Jackie Shay",
      "url": "https://www.eemb.ucsb.edu/people/faculty/shay",
      "status": 200,
      "data": {
        "email": "jshay@ucsb.edu",
        "phone": "805.893.2974",
        "title": "Main navigation",
        "office": "Office:\n \n4320 Life Sciences Building",
        "interests": null,
        "bio": "",
        "website": "https://undergrad.biology.ucsb.edu/",
        "fullText": "Skip to main content\nMain navigation\nAbout\nPeople\nResearch\nAcademics \nNews\nEvents\nSupport \nGive\nPeople  Faculty\nJackie Shay\nAssistant Teaching Professor\nEmail:\n \njshay@ucsb.edu\nOffice:\n \n4320 Life Sciences Building\nWebsite:\n \nSite\nPublications Link:\n \nGoogle Scholar\nAreas of Research\nEcology\nEcosystem Ecology\nMicrobial Ecology\nOrganismal Biology\nPopulation and Community Ecology\nEvolutionary Ecology\nResearch\n\nJoy-centered pedagogy in biology education, teacher professional development, epistemologies in STEM, accessible course-based research experiences, and all things fungal.\n\nContact Us\n 805.893.2974\n info@eemb.ucsb.edu\n Jobs\n Visit EEMB\nSupport Services\n Administration\n Room Reservations\n Research Services\nTechnical Support\nShipping / Receiving\nWebsite\n Information\n Terms of Use\n Privacy\n Login\n  \n\nEcology, Evolution, and Marine Biology\nUniversity of California, Santa Barbara\n© 2025 Regents of the University of California"
      }
    },
    {
      "name": "Adrian Stier",
      "url": "https://www.eemb.ucsb.edu/people/faculty/stier",
      "status": 200,
      "data": {
        "email": null,
        "phone": null,
        "title": "Who We Are",
        "office": null,
        "interests": null,
        "bio": null,
        "website": "https://scholar.google.com/citations?user=bxbOvMgAAAAJ&hl=en",
        "fullText": " Recovering ocean ecosystems \n\nWe study resilience from individuals to ecosystems.\nPartnering with managers and communities, we translate this science into strategies that drive recovery.\n\nWho We Are\n\nWe are a research group at UC Santa Barbara exploring resilience from the level of individual organisms to entire marine ecosystems. Our team blends field experiments, quantitative models, and synthesis to uncover the processes that shape biodiversity and stability. By partnering with managers and communities, we translate these insights into strategies that guide conservation, restoration, and recovery.\n\nMeet the Team\nImpact, at a glance\n80\npeer-reviewed publications\n$10M+\ncompetitive research funding\n14\nopen datasets & software (DOIs)\n20+\nactive partners & institutions\nGoogle Scholar\nORCID\nGitHub\nFeatured Papers\n\nNumbers current as of Sept 2025. Funding reflects cumulative competitive awards as PI or co-PI.\n\nResearch Themes\nCoral Reefs\n\nField experiments and models reveal how disturbance, biotic interactions, and restoration actions shape coral resilience and regeneration.\n\nExplore\nKelp Forest Resilience\n\nHow climate, fishing, and community feedbacks govern kelp recovery—linking experiments, time series, and decision frameworks for management.\n\nExplore\nOrganismal Mechanisms\n\nFrom wound healing to thermal limits: identifying thresholds and biological signatures that scale from individuals to ecosystem outcomes.\n\nExplore\nGet Involved\nFunders\n\nSee how your support drives measurable conservation and restoration outcomes.\n\nSee Our Impact\nCollaborators\n\nPartner with us on experiments, synthesis, and restoration projects.\n\nExplore Research\nStudents\n\nDiscover undergraduate and graduate opportunities in the lab.\n\nJoin the Lab\nFeatured Papers\nResilience thresholds in kelp forests\n\nIdentifies tipping points where urchin control rapidly restores kelp canopy—now used to set action triggers with managers.\n\nOpen Access\nData & Code\nRead paper\nData / code\nCoral recovery pathways unde"
      }
    },
    {
      "name": "Samuel Sweet",
      "url": "https://www.eemb.ucsb.edu/people/faculty/sweet",
      "status": 200,
      "data": {
        "email": "sweet@lifesci.ucsb.edu",
        "phone": "805.893.3730",
        "title": "Main navigation",
        "office": "Office:\n \n1124 Noble Hall",
        "interests": null,
        "bio": "",
        "website": "https://undergrad.biology.ucsb.edu/",
        "fullText": "Skip to main content\nMain navigation\nAbout\nPeople\nResearch\nAcademics \nNews\nEvents\nSupport \nGive\nPeople  Faculty\nSamuel Sweet\nProfessor\nPhone:\n \n805.893.3730\nEmail:\n \nsweet@lifesci.ucsb.edu\nOffice:\n \n1124 Noble Hall\nLab:\n \n1224 Noble Hall\nPublications Link:\n \nGoogle Scholar\nAreas of Research\nBehavior\nEvolution\nEvolutionary Ecology\nMacroevolution\nOrganismal Biology\nPopulation and Community Ecology\nZoology\nResearch\n\nDistributional ecology and systematics of western North American and Australian amphibians and reptiles; ecology and systematics of monitor lizards; mechanics of intergrade zones and of speciational processes; crypsis; functional and evolutionary morphology; ethnozoology; conservation biology.\n\nContact Us\n 805.893.2974\n info@eemb.ucsb.edu\n Jobs\n Visit EEMB\nSupport Services\n Administration\n Room Reservations\n Research Services\nTechnical Support\nShipping / Receiving\nWebsite\n Information\n Terms of Use\n Privacy\n Login\n  \n\nEcology, Evolution, and Marine Biology\nUniversity of California, Santa Barbara\n© 2025 Regents of the University of California"
      }
    },
    {
      "name": "Audrey Thellman",
      "url": "https://www.eemb.ucsb.edu/people/faculty/thellman",
      "status": 200,
      "data": {
        "email": "athellman@ucsb.edu",
        "phone": "805.893.2974",
        "title": "Main navigation",
        "office": "Office:\n \nNoble Hall 1112",
        "interests": null,
        "bio": "",
        "website": "https://undergrad.biology.ucsb.edu/",
        "fullText": "Skip to main content\nMain navigation\nAbout\nPeople\nResearch\nAcademics \nNews\nEvents\nSupport \nGive\nPeople  Faculty\nAudrey Thellman\nAssistant Professor of Freshwater Ecology\nEmail:\n \nathellman@ucsb.edu\nOffice:\n \nNoble Hall 1112\nAreas of Research\nEcology\nEcosystem Ecology\nBiography\n\nAudrey Thellman received a B.S. in Environmental Sciences with a concentration in Earth Sciences from the University of Notre Dame in 2018. Under the mentorship of Dr. Emily Bernhardt, Dr. Thellman went on to study how freshwater primary producers respond to warming winters and other climatic drivers in the Northeastern United States and beyond, receiving her PhD in Ecology from Duke University in 2023. Before joining the faculty in the Ecology, Evolution and Marine Biology Department at UCSB, Dr. Thellman spent two years working with Dr. Tamlin Pavelsky as a Postdoctoral Research Associate at the University of North Carolina at Chapel Hill. There, she worked on creating an ice cover dataset for 100,000s of lakes globally using optical remote sensing. Her current research focus is on how freshwater ecosystems are responding to climate change, especially responses to changing ice and snow conditions.\n\nResearch\n\nClimate change is fundamentally altering the quantity and quality of freshwaters on the planet. Understanding how freshwater ecosystems are responding to this change, especially at the base of the food web, is not only fundamental to ecology but also to humans that rely heavily on freshwater for consumption, agriculture, and recreation. The advent of new technology in freshwater ecology makes it possible to evaluate how the complex interactions of climate and human-induced changes are shifting the ecology of rivers and lakes. In our lab group, we evaluate the energetic and biogeochemical consequences of a changing climate in inland waters. We use a suite of tools and emerging resources, from sensors to satellites, to evaluate two broad research questions: 1. What controls the timing and"
      }
    },
    {
      "name": "Andrew Thurber",
      "url": "https://www.eemb.ucsb.edu/people/faculty/thurber",
      "status": 200,
      "data": {
        "email": "athurber@ucsb.edu",
        "phone": "805.893.2974",
        "title": "Main navigation",
        "office": "Office:\n \nNoble Hall 2136",
        "interests": null,
        "bio": "",
        "website": "https://undergrad.biology.ucsb.edu/",
        "fullText": "Skip to main content\nMain navigation\nAbout\nPeople\nResearch\nAcademics \nNews\nEvents\nSupport \nGive\nPeople  Faculty\nAndrew Thurber\nAssociate Professor\nEmail:\n \nathurber@ucsb.edu\nOffice:\n \nNoble Hall 2136\nWebsite:\n \nLab website\nPublications Link:\n \nGoogle Scholar\nAreas of Research\nAquatic Biology\nBiological Oceanography\nEcology\nEcosystem Ecology\nMarine Biology\nMicrobial Ecology\nOrganismal Biology\nPopulation and Community Ecology\nZoology\nBiography\n\nI received my Bachelor’s of Science in Marine Biology from Hawai'i Pacific University with a minor in Mathematics.  During this time I fell in love with the mud as an ecosystem, a juxtaposition of microbes and strange (and sometimes beautiful) invertebrates whose integrated processes shape the world around us. I then turned to the Antarctic, and under the mentorship of Dr. Stacy Kim, I received a Master’s in Marine Science from Moss Landing Marine Laboratories focusing on Antarctic ecology. During my PhD from Scripps Institution of Oceanography, I was advised by Dr. Lisa Levin and studied food-web ecology of deep-sea methane seeps. After completing my PhD, I was a National Science Foundation Polar Postdoctoral Fellow hosted at Oregon State University, where I then became a faculty member in the College of Earth, Ocean, and Atmospheric Sciences and the Department of Microbiology, College of Science prior to starting my current position at UCSB in 2024.\n\nResearch\n\nMy research focuses on how deep-sea and polar communities function.  These areas cover well over 63 percent of the globe, provide a wealth of services to mankind, and yet remain largely unknown and unexplored. While my research ranges across all ocean depths, the ultimate goal is to increase our understanding of the planet around us.\n\nA main focus of this work is identifying how microbial processes are impacted by multicellular animals, especially in soft-sediment habitats.  Bacteria and Archaea are well known to be dominant drivers in the biogeochemical cycling of the "
      }
    },
    {
      "name": "Thomas Turner",
      "url": "https://www.eemb.ucsb.edu/people/faculty/turner",
      "status": "pending"
    },
    {
      "name": "Rosa Vasquez",
      "url": "https://www.eemb.ucsb.edu/people/staff/vasquez",
      "status": "pending"
    },
    {
      "name": "Rebecca Vega Thurber",
      "url": "https://www.eemb.ucsb.edu/people/faculty/vega-thurber",
      "status": "pending"
    },
    {
      "name": "Patrick White",
      "url": "https://www.eemb.ucsb.edu/people/staff/white",
      "status": "pending"
    },
    {
      "name": "Lizzy Wilbanks",
      "url": "https://www.eemb.ucsb.edu/people/faculty/wilbanks",
      "status": "pending"
    },
    {
      "name": "Ellery Wilkie",
      "url": "https://www.eemb.ucsb.edu/people/staff/wilkie",
      "status": "pending"
    },
    {
      "name": "Mengshu Ye",
      "url": "https://www.eemb.ucsb.edu/people/staff/ye",
      "status": "pending"
    },
    {
      "name": "Soojin Yi",
      "url": "https://www.eemb.ucsb.edu/people/faculty/yi",
      "status": "pending"
    },
    {
      "name": "Hillary Young",
      "url": "https://www.eemb.ucsb.edu/people/faculty/young",
      "status": "pending"
    },
    {
      "name": "Yong Zhou",
      "url": "https://www.eemb.ucsb.edu/people/faculty/zhou",
      "status": "pending"
    }
  ]
}